name,minutes,tags,nutrition,n_steps,steps,description,ingredients,n_ingredients
pickled peaches,60,"['60-minutes-or-less', 'time-to-make', 'main-ingredient', 'preparation', 'occasion', 'low-protein', 'healthy', 'canning', 'fruit', 'low-fat', 'picnic', 'summer', 'vegan', 'vegetarian', 'dietary', 'gifts', 'low-sodium', 'low-cholesterol', 'seasonal', 'low-saturated-fat', 'low-in-something', 'pitted-fruit', 'peaches', 'to-go', 'number-of-servings', 'technique']","[3252.1, 6.0, 3162.0, 1.0, 25.0, 2.0, 270.0]",16,"['combine sugar and vinegar in a 6 to 8 quart saucepan', 'bring to a boil , stirring to dissolve sugar', 'boil for 5 minutes', 'tie spices in spice bag or cheesecloth', 'add spice bag and peaches to syrup', 'simmer for about 5 to 10 minutes or until peaches are cooked but not too soft , stirring peaches gently to cook all sides', 'cover and let stand in a cool place for 12 to 18 hours , stirring peaches 2 or 3 times', 'bring peaches to a boil', 'remove them from heat and remove spices', 'skim off foam , if necessary', 'immediately fill hot pint or quart jars with mixture , leaving 1 / 2 inch headspace', 'carefully run a nonmetalic utensil down inside of jars to remove trapped air bubbles', 'wipe jar tops and threads clean', 'place hot lids on jars and screw bands on firmly', 'process in boiling water canner for 25 minutes for quarts or 20 minutes for pints', 'yield: appproximately 2 quarts or 4 to 5 pints']",one of my favorites from when i was a kid! yummmm. these are cooked and then let stand for 12 to 18 hours and then canned.,"['peaches', 'sugar', 'white vinegar', 'cinnamon sticks', 'clove', 'ground ginger']",6
mac  n cheese and spinach strata  sp5,50,"['60-minutes-or-less', 'time-to-make', 'course', 'main-ingredient', 'cuisine', 'preparation', 'north-american', '5-ingredients-or-less', 'side-dishes', 'pasta', 'potatoes', 'vegetables', 'american', 'easy', 'northeastern-united-states', 'pennsylvania-dutch', 'pasta-rice-and-grains', 'elbow-macaroni', 'simply-potatoes']","[194.5, 16.0, 7.0, 14.0, 15.0, 30.0, 6.0]",9,"['heat oven to 350 degrees f', 'coat a 2-3 quart glass baking dish with cooking spray', 'set aside', 'transfer 1 package of the heated simply macaroni and cheese to the bottom of prepared baking dish and spread evenly', 'top evenly with spoonfuls of spinach', 'cover spinach with 2nd package of macaroni and cheese and spread evenly', 'in a small bowl , combine the breadcrumbs , butter and cheese', 'sprinkle over casserole', 'bake for 30-35 minutes or until hot and bubbly and crumbs are just starting to brown']","official contest entry: simply potatoes 5fix.  a combination of 2 of my favorite foods, this creamy, cheesy casserole is made with simply macaroni & cheese and layered with chopped spinach.  buttery and cheesy breadcrumbs top this delicious dish and give it an added punch of flavor.","['simply macaroni & cheese', 'frozen spinach', 'breadcrumbs', 'butter', 'parmesan cheese']",5
pistachio lemon chicken,30,"['30-minutes-or-less', 'time-to-make', 'course', 'main-ingredient', 'preparation', 'main-dish', 'fruit', 'poultry', 'nuts', 'chicken', 'dietary', 'citrus', 'lemon', 'meat', 'chicken-breasts']","[205.8, 12.0, 3.0, 3.0, 57.0, 6.0, 1.0]",6,"['in an ungreased heavy skillet over medium-low heat , toast pistachios 5-7 minutes , stirring frequently until beginning to brown , then stirring constantly until golden brown', 'flatten each chicken breast half to 1 / 4-inch thickness', 'sprinkle both sides of chicken with lemon pepper seasoning', 'heat oil in a 12-inch skillet over medium-high heat', 'cook chicken , lemon juice and lemon peel in oil 10-15 minutes , turning chicken once and stirring juices occasionally , until chicken is cooked through', 'serve chicken topped with pan juices , nuts and garnish with lemon slices']",from betty crocker's best chicken cookbook. quick to prepare with a bright lemony flavor.,"['boneless skinless chicken breast halves', 'lemon pepper', 'vegetable oil', 'lemon juice', 'lemon peel', 'pistachios', 'lemon slice']",7
down home pancakes  vegan,15,"['15-minutes-or-less', 'time-to-make', 'course', 'main-ingredient', 'preparation', 'for-1-or-2', 'pancakes-and-waffles', 'breakfast', 'vegetables', 'vegan', 'vegetarian', 'dietary', 'number-of-servings']","[701.2, 41.0, 30.0, 42.0, 40.0, 11.0, 34.0]",7,"['in a large mixing bowl , whisk together the flours , baking powder , cinnamon , baking soda & salt , then set aside', 'in another mixing bowl , whisk together the water , soy milk , flax meal , maple syrup & just 1 tablespoon of canola oil , blending well', 'pour wet ingredients into the flour mixture , & mix together with a wooden spoon', 'heat the 2 tablespoons of canola oil in a large frying pan over medium heat', 'for each pancake , pour 1 / 2 cup of batter into the frying pan & spread into a 4-inch circle , then cook about 1 1 / 2 minutes , or until the tops are bubbly & the edges are dry', 'using a spatula , turn the pancakes over & cook for another minute , or until the bottoms are golden brown', 'serve hot with the topping of your choice']","found this vegan recipe in the as you like it cookbook, 2001, along with its regular counterpart.","['whole wheat flour', 'unbleached white flour', 'oat flour', 'baking powder', 'ground cinnamon', 'baking soda', 'sea salt', 'water', 'soymilk', 'flax seed meal', 'pure maple syrup', 'canola oil']",12
jean s cookies,35,"['60-minutes-or-less', 'time-to-make', 'course', 'preparation', 'for-large-groups', 'drop-cookies', 'desserts', 'cookies-and-brownies', 'number-of-servings']","[303.7, 14.0, 113.0, 7.0, 9.0, 13.0, 17.0]",6,"['cream the margarine with the sugars', 'add the eggs and salt and mix until smooth', 'blend in the baking soda / water mixture', 'add oatmeal , flour , rice krispies , and chocolate chips', 'drop by spoonfuls on a lightly greased cookie sheet', 'bake 10-15 minutes in a 350 oven until lightly browned']","these were originally dubbed ""chicken cookies"" by our church youth group.  i have no idea why, but the name stuck.  i didn't want to post them that way for obvious reasons. ;)  anyway, these are a big hit for road trips, and what kid-young or old-doesn't love cookies?!","['margarine', 'brown sugar', 'granulated sugar', 'powdered sugar', 'eggs', 'salt', 'warm water', 'oatmeal', 'flour', 'rice krispies', 'chocolate chips']",11
crisp coconut shrimp with oriental dipping sauce,30,"['30-minutes-or-less', 'time-to-make', 'course', 'main-ingredient', 'cuisine', 'preparation', 'occasion', 'appetizers', 'fruit', 'seafood', 'asian', 'easy', 'dinner-party', 'finger-food', 'nuts', 'shrimp', 'stove-top', 'coconut', 'shellfish', 'brunch', 'taste-mood', 'equipment', 'presentation']","[186.3, 9.0, 63.0, 7.0, 21.0, 23.0, 7.0]",10,"['in a small bowl , combine marmalade , green onion , lime juice and cayenne pepper and 2 / 1 / 8 tsp salt', 'mix well', 'set aside', 'in another small bowl , beat together egg , cornstarch and 1 / 8 tsp salt with a fork or wire whisk until smooth', 'in a shallow dish or bowl , combine coconut and bread crumbs', 'dip shrimp in egg mixture', 'coat with combined coconut and crumbs', 'fry in oil in 3 to 4 batches until shrimp is golden brown', 'drain on paper towels', 'serve with oriental dipping sauce']",a thai influenced appetizer that dd#1 (the chef) rates highly.  i dont like fish so personally have not tried it but she had fixed it many time and it always gets rave reviews.,"['egg', 'cornstarch', 'salt', 'large shrimp', 'sweetened flaked coconut', 'dry breadcrumbs', 'oil', 'orange marmalade', 'green onions', 'lime juice', 'cayenne pepper']",11
albndigas,90,"['time-to-make', 'course', 'main-ingredient', 'cuisine', 'preparation', 'occasion', 'north-american', 'healthy', 'soups-stews', 'seafood', 'mexican', 'holiday-event', 'low-fat', 'fish', 'dietary', 'low-cholesterol', 'low-saturated-fat', 'low-calorie', 'low-carb', 'healthy-2', 'low-in-something', '4-hours-or-less']","[239.2, 6.0, 25.0, 44.0, 35.0, 5.0, 10.0]",17,"['for the soup: heat some oil in a large pot over medium heat', 'add onion and garlic cook for 3 minutes being careful not to burn', 'add chopped tomatoes , tomato sauce , stock , oregano , salt , pepper , carrots , potatoes , and celery and bring to a boil', 'when the soup has reached a boil , cover and bring down to low heat', 'pour some oil into a pan and slightly brown the rice then add to the soup', 'for the albndigas: add the liquid from the canned salmon to the soup and place the salmon in a large bowl', 'break up the salmon into very small pieces with a fork', 'in a medium bowl , mix the bread crumbs and the egg until well combined', 'add the onions , garlic , salt pepper , cumin and cilantro', 'add the salmon and incorporate with the other ingredients', 'shape the mixture into one inch balls', 'you should have enough for 12-16 albndigas', 'pour enough oil into a large pan to cover the bottom', 'fry the albndigas until brown all over', 'add to the soup', 'simmer until the rice is cooked and vegetables are tender', 'if soup is too thick pour in some additional water or stock']",this soup is great for lent.,"['olive oil', 'white onions', 'garlic clove', 'chopped tomatoes', 'tomato sauce', 'chicken stock', 'dry oregano', 'salt', 'fresh ground black pepper', 'carrots', 'celery', 'potato', 'rice', 'egg', 'panko breadcrumbs', 'green onions', 'ground black pepper', 'ground cumin', 'cilantro', 'pink salmon']",20
sarasota s pork baby back ribs,1620,"['weeknight', 'time-to-make', 'course', 'main-ingredient', 'cuisine', 'preparation', 'occasion', 'north-american', 'very-low-carbs', 'main-dish', 'pork', 'american', '1-day-or-more', 'easy', 'beginner-cook', 'dinner-party', 'dietary', 'high-protein', 'low-carb', 'high-in-something', 'low-in-something', 'meat', 'pork-ribs']","[997.2, 109.0, 1.0, 50.0, 153.0, 128.0, 2.0]",24,"['ribs and rub -- the night before you plan to cook these , i mix all the ingredients in a small bowl and then rub the ribs', 'just rub them up , on both sides', 'wrap in plastic wrap and put 2 ribs in each of the aluminum tins', 'refrigerate over night', 'baking the ribs -- the next day , in the same aluminum pans , just remove the saran wrap , cut each of the racks in half to make them easier to handle , and put the ribs in the pan', 'add the beer , 1 tablespoon cider vinegar per pan , bay leaf and cover with foil', 'cook covered with foil for 2 1 / 2 hours at 350', ""now i check at 2 hours because you don't want them falling apart before you grill them"", 'i have had some take 2 hours -- so just after 1 1 / 2 hours , take a peek', 'you want a knife to go in easy but not falling apart', 'you should be able to pick up the half rack easily but they still should be very tender', 'grilling -- remove from the oven and take to the grill', 'place on a medium grill and grill one side for 3-4 minutes then flip', 'then time to sauce up', 'sauce each side and flip a couple of times and that is all you need', 'i like to put enough sauce on for flavor , but i also like my sauce to dry a bit so they are not they messy to eat', ""it you don't have a grill you can finish in the oven on high heat 450 for just a few minutes too"", 'but the grill is what makes these', 'i usually cut the ribs in two and serve family style', 'the meat falls off the bone and great flavor', ""sauce , everyone has their favorites -- i like my own bourbon sauce , but i won't get in a bbq battle"", 'just use your favorite', 'there are way too many', 'i happen to love a spicy store bought then mixed with a little bourbon and some smoky chipotles for a great easy sauce']","tender, falling apart, easy and just perfect.
nothing hard, nothing complicated and they are just good every time. serve these with traditional bbq food to me, mac and cheese, coleslaw, beans, corn on the cob etc.  anything you want.  bake unattended basically for 2+ hours and then a quick grill and they are done.  how easy can you get.  the overnight marinade gives them a great flavor.","['baby back ribs', 'paprika', 'cumin', 'chili powder', 'dried oregano', 'fresh ground black pepper', 'kosher salt', 'garlic powder', 'onion powder', 'dark beer', 'bay leaves', 'cider vinegar', 'barbecue sauce', 'bourbon']",14
the easiest  tastiest  yet  healthiest  chocolate milk,4,"['15-minutes-or-less', 'time-to-make', 'course', 'preparation', 'for-1-or-2', 'healthy', '5-ingredients-or-less', 'beverages', 'easy', 'low-fat', 'dietary', 'low-sodium', 'low-cholesterol', 'low-saturated-fat', 'low-calorie', 'healthy-2', 'low-in-something', 'number-of-servings', '3-steps-or-less']","[517.0, 19.0, 226.0, 21.0, 47.0, 34.0, 25.0]",3,"['pour the milk into a glass', 'mix the chocolate syrup with the milk until the color of the milk becomes brown', 'serve and sip']",it's easy to make! turn plain non-flavored milk into a delicious chocolate milk drink!,"['chocolate syrup', 'low-fat milk']",2
ginger ale with christmas spices,5,"['15-minutes-or-less', 'time-to-make', 'course', 'main-ingredient', 'preparation', 'occasion', 'for-1-or-2', '5-ingredients-or-less', 'beverages', 'fruit', 'easy', 'holiday-event', 'cocktails', 'christmas', 'citrus', 'oranges', 'number-of-servings', '3-steps-or-less']","[126.0, 0.0, 63.0, 0.0, 0.0, 0.0, 5.0]",2,"['fill a highball glass with ice', 'add remaining ingredients']","from ricardo, using this recipe : recipe#269837","['ginger ale', 'rum', 'spices', 'cinnamon stick', 'orange peel']",5
trinidadian black eyed pea soup,150,"['time-to-make', 'course', 'preparation', 'main-dish', 'soups-stews', 'vegan', 'vegetarian', 'stove-top', 'dietary', 'equipment', '4-hours-or-less']","[128.3, 8.0, 9.0, 6.0, 7.0, 3.0, 5.0]",11,"['add oil to a large pan over medium-high heat', 'add in the bell pepper , onion , and carrots', 'stir / saute for 3 minutes or until the onion turns translucent and slightly browned at the edges', 'add in the cilantro', 'stir once', 'add in the peas , stock , rice , ginger , allspice , thyme , mustard , and chile pepper', 'stir and bring to a boil', 'cover', 'lower heat to low and simmer gently for 1 1 / 2 hours--stir occasionally', 'add salt and more pepper to taste if needed', 'serve garnished with chives and with a lemon or lime wedge on the side']",from madhur jaffery's world vegetarian.,"['olive oil', 'green bell pepper', 'onion', 'carrots', 'cilantro', 'black-eyed peas', 'vegetable stock', 'brown rice', 'ground ginger', 'ground allspice', 'dried thyme', 'mustard powder', 'scotch bonnet pepper', 'salt', 'chives', 'limes']",16
ground turkey tomato sauce,380,"['weeknight', 'time-to-make', 'course', 'main-ingredient', 'cuisine', 'preparation', 'for-large-groups', 'condiments-etc', 'poultry', 'european', 'italian', 'turkey', 'crock-pot-slow-cooker', 'dietary', 'low-saturated-fat', 'low-calorie', 'low-carb', 'low-in-something', 'meat', 'equipment', 'number-of-servings']","[208.6, 13.0, 48.0, 28.0, 30.0, 10.0, 5.0]",5,"['brown ground turkey with chopped onions until meat is no longer pink , and juices run clear', 'drain the excess juice', 'mix remaining ingredients in a crock pot and stir well', 'add turkey and onions to mixture and stir again', 'simmer in covered crock pot on low for approx 6 hours , stirring occasionally']",1/2 cup servings,"['ground turkey', 'spaghetti sauce', 'onion', 'oregano', 'garlic', 'basil', 'sugar', 'cayenne pepper']",8
baked apple fritters,255,"['weeknight', 'time-to-make', 'course', 'main-ingredient', 'preparation', 'healthy', 'breads', 'fruit', 'low-fat', 'dietary', 'low-sodium', 'low-cholesterol', 'low-saturated-fat', 'healthy-2', 'yeast', 'low-in-something', 'apples', 'number-of-servings']","[175.5, 3.0, 71.0, 3.0, 7.0, 2.0, 12.0]",23,"['sprinkle yeast over warm water and set aside for 5 minutes', 'meanwhile , combine hot milk , margarine , sugar and salt in the bowl of food processor', 'let stand until margarine melts', 'beat in 1 1 / 2 cups of flour', 'add yeast mixture , cinnamon and egg', 'process or beat until combined', 'add other 2 cups flour and process or mix and knead on board', 'add additional flour if needed', 'place dough in greased bowl', 'turn to grease top', 'cover and let rise about 1 1 / 2 hours or let rise in the refrigerator over night', 'punch dough down', 'mix in apples', 'divide dough into thirds', 'cut dough with shears or chop with sharp knife', 'shape cut dough into six mounds on a greased baking sheet', 'repeat with other two sections of dough', 'cover and let rise at room temperature until double in bulk , about 1 hour', 'uncover and bake at 350 degrees for about 15 minutes or until golden', 'meanwhile , place powdered sugar in food processor', 'process until fluffy , not lumpy', 'slowly add lemon juice and keep processing until smooth and satiny', 'while fritters are still warm spoon on glaze']",after losing 50 lbs. my husband requested lowfat apple fritters. an internet search provided a recipe from www.shashek.com now modified to use a food processor.,"['active dry yeast', 'warm water', 'nonfat milk', 'margarine', 'sugar', 'salt', 'whole wheat pastry flour', 'unbleached flour', 'cinnamon', 'egg', 'apples', 'powdered sugar', 'lemon juice']",13
mint chicken,60,"['60-minutes-or-less', 'time-to-make', 'main-ingredient', 'preparation', 'for-1-or-2', 'poultry', 'chicken', 'stove-top', 'dietary', 'meat', 'chicken-thighs-legs', 'equipment', 'number-of-servings']","[651.1, 68.0, 25.0, 8.0, 95.0, 53.0, 4.0]",12,"['heat oil in a skillet', 'add the onions and fry till golden in colour', 'add the turmeric powder , red chilli powder , corriander powder and green chillies', 'mix', 'fry for a few minutes', 'add the chicken pieces', 'cook on either side', 'add the mint-corriander paste and yoghurt', 'mix well', 'add salt to taste', 'sprinkle garam masala and cook till chicken is tender', 'serve hot']",passed on to me from a cousin. yummy chicken!,"['chicken legs', 'cooking oil', 'onion', 'green chilies', 'mint and coriander leaves paste', 'salt', 'yoghurt', 'garam masala', 'turmeric powder', 'red chili powder', 'coriander powder']",11
mankomo s farmhouse bread,120,"['time-to-make', 'course', 'preparation', 'healthy', 'breads', 'low-fat', 'dietary', 'low-cholesterol', 'low-saturated-fat', 'yeast', 'low-in-something', '4-hours-or-less']","[3664.5, 15.0, 11.0, 397.0, 212.0, 8.0, 255.0]",9,"['preheat oven to 200c / 392f', 'mix all the dry ingredients and then add the butter if using', 'gradually mix in the water and knead until you have an elastic dough which comes away from the sides of the bowl', 'if kneading by hand , do so for 10 minutes , 3 minutes with a food mixer', 'allow to rise in a warm place , covering the bowl with clingwrap until the dough has doubled in size', 'knead again lightly and place in a bread tin', 'leave to rise again until doubled', 'bake at 200c / 392f for 15 minutes , then turn the oven down to 180c / 356f and bake for a further 45 minutes or so , or until the loaves sound hollow when', 'you can use a variety of different flours in this recipe , as long as you end up with 1kg of flour in total']","this bread is what we in south africa would term plaasbrood - farm bread.  you know the one, those loaves made by generations of farmer's wives where no written recipe really exists.  no bread machine needed for this, kneading takes all of 10 minutes with two rising periods.  delicious.

the recipe appears in quiet life, a buddhist recipe book.","['flour', 'white bread flour', 'salt', 'dried yeast', 'sugar', 'butter', 'water']",7
ranch dressing from scratch,4,"['15-minutes-or-less', 'time-to-make', 'course', 'preparation', 'low-protein', 'sauces', 'salads', 'condiments-etc', 'easy', 'beginner-cook', 'kid-friendly', 'vegetarian', 'salad-dressings', 'dietary', 'inexpensive', 'savory-sauces', 'low-in-something']","[171.6, 20.0, 18.0, 21.0, 3.0, 10.0, 3.0]",13,"['get out a medium sized bowl', 'measure the mayonnaise into it', 'gradually whisk in the buttermilk or yogurt', 'if you use powdered buttermilk , whisk in the powder first , and then slowly add a cup of water', 'then add the seasonings', 'whisk again', 'or you can make it in the blender by putting everything into the blender and whirling until smooth', 'the mixture will be a little thin , but it will thicken on standing', 'store in a pint size jar , makes 2-cups', 'keep in the refrigerator for a few weeks', 'tastes really good with yogurt by the way', 'this is my favorite way of making it', 'it tastes good with powdered buttermilk too , but the consistency is thinner than with yogurt']",once you make this simple dressing you will never buy another bottle of the stuff. this is far superior even to the name brand. from hillbillyhousewife.com. i always use buttermilk but yogurt is ok too.,"['mayonnaise', 'buttermilk', 'parsley', 'onion powder', 'garlic powder', 'salt', 'dill weed', 'pepper']",8
fresh herb bread,70,"['weeknight', 'time-to-make', 'course', 'preparation', 'occasion', 'breads', 'bread-machine', 'holiday-event', 'dietary', 'christmas', 'yeast', 'equipment', 'small-appliance', 'number-of-servings', '4-hours-or-less']","[1809.3, 51.0, 140.0, 112.0, 96.0, 46.0, 108.0]",7,"['measure carefully , placing all ingredients in bread machine pan in', 'the order recommended by the manufacturer', 'select basic / white cycle', 'use medium or light crust color', 'remove from pan and cool on wire rack', 'recommend using bread machines with 9-cup or larger bread pan for', 'this recipe']",,"['water', 'margarine', 'flour', 'fresh sage leaves', 'fresh basil leaf', 'oregano leaves', 'fresh thyme leaves', 'fresh parsley', 'dry milk', 'sugar', 'salt', 'yeast']",12
warm broccoli and cheese dip,50,"['60-minutes-or-less', 'time-to-make', 'course', 'preparation', 'occasion', '5-ingredients-or-less', 'appetizers', 'easy', 'potluck', 'dinner-party', 'holiday-event', 'dips', 'dietary', 'christmas', 'new-years', 'high-calcium', 'comfort-food', 'low-carb', 'high-in-something', 'low-in-something', 'brunch', 'superbowl', 'taste-mood', 'to-go', '3-steps-or-less']","[157.5, 19.0, 4.0, 13.0, 14.0, 39.0, 1.0]",4,"['preheat oven to 350f', 'mix soup mix , sour cream , broccoli , and 1 1 / 2 cups cheese in a greased shallow casserole dish', 'bake for about 30 minutes', 'sprinkle with rest of cheese and bake until bubbly and warmed through']",i actually found this recipe on the back of the dry soup mix package and needed to bring something to the family reunion.  all the women begged for the recipe. i serve it with tortilla chips or multi-grain crackers.,"['dry vegetable soup mix', 'sour cream', 'frozen chopped broccoli', 'cheddar cheese']",4
herbed green beans,20,"['30-minutes-or-less', 'time-to-make', 'course', 'main-ingredient', 'preparation', 'side-dishes', 'vegetables', 'vegan', 'vegetarian', 'dietary', 'green-yellow-beans']","[59.3, 3.0, 17.0, 6.0, 4.0, 1.0, 2.0]",7,"['add beans to medium saucepan with water to cover and bring to a boil', 'reduce heat to low', 'simmer 4 to 6 minutes or until crisp-tender', 'drain', 'return beans to pan', 'add vinegar , oil , and spices to pan , tossing with beans', 'cook and stir over medium heat 1 to 2 minutes or until heated through']",based on a recipe from a mccormick spices for health pamphlet extoling the power of super spices as natural antioxidants.,"['green beans', 'balsamic vinegar', 'olive oil', 'dried rosemary leaves', 'dried thyme leaves', 'sea salt', 'ground black pepper']",7
murray s french toast,10,"['15-minutes-or-less', 'time-to-make', 'course', 'preparation', 'pancakes-and-waffles', 'breakfast', 'kid-friendly', 'dietary']","[220.0, 18.0, 44.0, 11.0, 10.0, 32.0, 7.0]",16,"['sugarbutter: using the tines of a fork , mix butter and sugar in a small bowl', 'do not beat', 'set aside', 'beat eggs and milk in a bowl large enough to fit a slice of bread', 'heat a small pat of butter in a large pan or griddle over medium heat', 'when butter is melted in pan , dip 1 slice of bread into the egg mixture , flip over , then hold it over the bowl for a second or so to let excess egg drip off', 'place into pan and sprinkle with a light dusting of cinnamon', 'repeat with other slices', 'cook for 3-5 minutes until golden brown', 'flip toast and cook remaining side to golden', 'place one toast each onto individual plates', 'spread sugar-butter over one side', 'place another slice on top and repeat', 'continue until you reach the desired stack amount and serve', 'i love to eat the crust off first , then dive into the center of soft french toast smothered in sugar-butter to divulge into at the end', 'a mouth-watering experience !']","this is my (bird's) favorite french toast recipe. growing up with 4 siblings, my dad would make sugar-butter when there was no syrup in the house (hence 'murray's', named after my dad). some folks like it on pancakes, but for me, it's on french toast all the way! i even have a 'pattern' to how i eat it. i haven't tried it using splenda yet, so i guess i need to soon, but then, this is not a 'diet-conscience' recipe. when we were real broke, and there was no money even for dog food, my dad would leave some egg mixture in the bowl, break up some bread in it, and the dog (and cats) ate too (we were always bringing home strays). :)  my dad was the master of inginuity, making sure we all had full bellies!","['butter', 'sugar', 'eggs', '2% low-fat milk', 'white bread', 'ground cinnamon']",6
