name,minutes,tags,nutrition,n_steps,steps,description,ingredients,n_ingredients
white chicken mushroom spaghetti,65,"['time-to-make', 'course', 'main-ingredient', 'preparation', 'occasion', 'main-dish', 'pasta', 'poultry', 'dinner-party', 'chicken', 'meat', 'chicken-breasts', 'pasta-rice-and-grains', 'spaghetti', '4-hours-or-less']","[373.6, 25.0, 6.0, 17.0, 56.0, 35.0, 8.0]",19,"['preheat oven to 350 degrees', 'butter a casserole dish', 'first slice or chop your mushrooms and onions , melt butter in saute or fry pan', 'add mushrooms and onion , get them cooking for a few minutes , uncovered , until they give up some of their juices , then add garlic , lemon juice , wine and let cook down a bit till barely moist and most juices evaporated', 'this will deepen their flavor', 'remove veggies from pan and set them aside in a big mixing bowl', 'add oil to the same pan , and throw in chicken , brown both sides', 'this should take about 5-10 minutes depending on your stove and the size of the pieces', 'throw browned chicken pieces on top of mushrooms and onions in the big mixing bowl', 'add a can of cream of mushroom soup', 'add sour cream on top', 'in the meantime , you will want to have boiled noodles per package instructions , and drain them', 'add noodles and 1 / 4 cup parmesan on top of everything else in the mixing bowl and gently mix it all together', 'if it is really thick , add a little of the pasta water to thin just a bit', 'after mixing it all , put it in a buttered casserole dish , sprinkle 1 / 4 cup more of parmesan on top of it all , and cover tightly with alum', 'foil', 'bake it in the oven covered for about 35-45 minutes depending on how thick your chicken slices were and the shape of your dish', 'tear foil off for last 5-10 minutes to crisp up the top', 'once out of oven , let it cool a few minutes before cutting it into serving portions']","when i help out with fundraisers for some of my kids sporting events, i always make a huge pot of spaghetti, but some people don't like red meat so i make a batch of this chicken spaghetti and it goes so fast it's gone in minutes!   my kids hate mushrooms, so i cut up the 'shrooms real small to avoid their complaints, but i think they really make this recipe great - feel free to cut the mushrooms up large or small as you like.  :)   this recipe reminds me of stroganov but it's the chicken version.","['boneless skinless chicken breasts', 'oil', 'mushrooms', 'garlic clove', 'shallot', 'butter', 'white wine', 'lemon juice', 'cream of mushroom soup', 'sour cream', 'parmesan cheese', 'spaghetti noodles']",12
chicken wing wraps,30,"['30-minutes-or-less', 'time-to-make', 'course', 'main-ingredient', 'preparation', 'occasion', 'lunch', 'main-dish', 'poultry', 'easy', 'chicken', 'freezer', 'dietary', 'spicy', 'sandwiches', 'oamc-freezer-make-ahead', 'meat', 'chicken-breasts', 'taste-mood', 'equipment', 'number-of-servings']","[617.9, 37.0, 29.0, 56.0, 61.0, 38.0, 22.0]",4,"['boil chicken breasts for 20 min , cool and shred apart', 'melt butter , add tobasco , spices , catsup and sugar and mix well', 'mix chicken into sauce', 'put 1 / 3 of chicken in tortilla , top with 1 / 3 veggies and 1 t blue cheese dressing , wrap and serve or cover with cling wrap and re-heat in microwave later for 1 1 / 2 min on high']","i needed something to make for my finace who works away from home. i never know when he is coming home so i need something i can re-heat or freeze if he doesnt come. he loves chicken wings so i made these up in my head fri night and they were great, he wants more for lunches now.","['chicken breasts', 'paprika', 'salt', 'black pepper', 'garlic powder', 'onion powder', 'butter', 'tabasco sauce', 'catsup', 'brown sugar', 'carrots', 'celery', 'lettuce', 'blue cheese dressing', 'tortillas']",15
shrimp and sausage jambalaya,65,"['weeknight', 'time-to-make', 'course', 'main-ingredient', 'cuisine', 'preparation', 'north-american', 'main-dish', 'seafood', 'american', 'southern-united-states', 'shrimp', 'creole', 'dietary', 'low-calorie', 'low-carb', 'low-in-something', 'shellfish', '4-hours-or-less']","[481.5, 41.0, 21.0, 48.0, 46.0, 39.0, 11.0]",12,"['heat oil in a large saucepan over medium heat', 'add sausage and cook for 2 minutes', 'add onions , bell peppers and celery', 'season with salt and cayenne and saute for 6 to 8 minutes or until golden , wilted and soft', 'add rice and stir to coat evenly', 'add tomatoes with juice , garlic , bay leaves , water and thyme', 'cover and cook over medium heat for about 20 minutes', 'season shrimp with salt and cayenne', 'add to mixture and cook for 10 more minutes', 'cook until rice is tender , liquid is absorbed and shrimp is pink', 'remove from heat and let stand covered for about 5 minutes', 'remove bay leaves and stir in green onions and serve']",this is very yummy. this was my first jambalaya recipe and it was perfect. i got the recipe from someone's web site ( www.colpean.com).,"['vegetable oil', 'smoked sausage', 'onions', 'bell pepper', 'celery', 'salt', 'cayenne', 'long-grain rice', 'tomatoes with juice', 'garlic', 'water', 'bay leaves', 'dried thyme', 'shrimp', 'green onion']",15
yucatan marinade,10,"['15-minutes-or-less', 'time-to-make', 'course', 'main-ingredient', 'cuisine', 'preparation', 'occasion', 'north-american', 'low-protein', 'healthy', 'condiments-etc', 'fruit', 'mexican', 'easy', 'beginner-cook', 'low-fat', 'spring', 'summer', 'marinades-and-rubs', 'dietary', 'low-cholesterol', 'seasonal', 'low-saturated-fat', 'low-calorie', 'low-in-something', 'citrus', 'lemon', 'lime', 'oranges', 'to-go', 'camping', '3-steps-or-less']","[151.3, 1.0, 74.0, 97.0, 6.0, 0.0, 12.0]",3,"['combine all ingredients in a medium bowl', 'if using with poultry or pork , marinate for 3 to 4 hours before grilling', 'fish and shellfish should marinate no longer than half an hour as the citrus will ""cook"" the seafood']","from firehouse food. you can use this tangy marinade on chicken, pork, prawns, scallops, or any firm fleshed fish. makes about 1 cup which is enough for 3 pounds of poultry, meat, or seafood.","['oranges, juice of', 'limes, juice of', 'lemons, juice of', 'garlic cloves', 'jalapeno chile', 'ground cumin', 'cayenne', 'dried oregano', 'salt']",9
tender pork chops with pineapple,95,"['time-to-make', 'course', 'main-ingredient', 'preparation', '5-ingredients-or-less', 'very-low-carbs', 'main-dish', 'pork', 'easy', 'beginner-cook', 'dietary', 'low-sodium', 'high-protein', 'low-carb', 'high-in-something', 'low-in-something', 'meat', 'pork-chops', '3-steps-or-less', '4-hours-or-less']","[857.4, 68.0, 44.0, 10.0, 189.0, 70.0, 4.0]",6,"['rub the chops with your favorite seasonings and brown in a skillet with a lid', 'now place one of the pineapple rings under each chop', 'pour pineapple juice from the can all over the chops', 'now drizzle with a good dose of teriyaki sauce', 'place remaining pineapple rings on top of each chop', 'cover pan with lid and bake for at least 90 minutes in a very slow oven - about 285']","my husband always want pork chops he can cut with a fork.  this is my easiest recipe and you can vary the seasoning, etc.  i can have this in the oven in 5 minutes.  awesome each time.  very easy and quick!","['pork chops', 'seasoning', 'olive oil', 'pineapple rings', 'teriyaki sauce']",5
moules marinieres   belgian mussels,15,"['15-minutes-or-less', 'time-to-make', 'preparation', 'for-1-or-2', 'dietary', 'low-calorie', 'low-carb', 'low-in-something', 'number-of-servings']","[675.1, 42.0, 11.0, 64.0, 121.0, 61.0, 8.0]",7,"['melt 1 tablespoon of butter in a casserole pot', 'add onions , celery , and saute for a few minutes', 'add the wine a bring to the boil', 'add the mussels and place lid on pot give a good shake to mix', 'cook until mussels have opened shaking even now and again', 'add 1 tablespoon of butter , cream and the parsley and stir', 'serve with crusty bread or as in belgium with frites']",mussels taste of the sea and a quick and easy to cook. i was always told to drink a glass or 2 of wine when eating mussels - why? i don't know.,"['mussels', 'onion', 'celery', 'white wine', 'pepper', 'butter', 'cream', 'parsley']",8
popcorn drops,28,"['30-minutes-or-less', 'time-to-make', 'course', 'preparation', 'for-large-groups', 'desserts', 'cookies-and-brownies', 'dietary', 'number-of-servings']","[5.4, 0.0, 1.0, 1.0, 0.0, 0.0, 0.0]",9,"['place popped corn in food processor or food grinder', 'grind into kernel-size pieces', 'beat egg whites until frothy and add baking powder , salt and cream of tartar', 'beat into stiff peaks', 'add sugar replacement , beating until well blended', 'fold popcorn pieces into stiffly beaten egg whites', 'drop by teaspoonfuls onto lightly greased cookie sheets', 'bake at 350 f for 12 to 14 minutes or until lightly browned', 'yield 36 cookies']","low fat, low cal cookies.  16 calories in 6 cookies. source: diabetic candy, cookie & dessert cookbook by mary jane finsand c. 1982","['popped popcorn', 'egg whites', 'baking powder', 'salt', 'cream of tartar', 'sugar substitute']",6
reuben in the round,20,"['30-minutes-or-less', 'time-to-make', 'course', 'main-ingredient', 'preparation', 'occasion', 'appetizers', 'lunch', 'eggs-dairy', 'easy', 'no-cook', 'finger-food', 'holiday-event', 'picnic', 'dips', 'cheese', 'dietary', 'high-calcium', 'high-protein', 'high-in-something', 'to-go', 'presentation', 'technique']","[818.3, 87.0, 16.0, 41.0, 94.0, 163.0, 10.0]",6,"['in large bowl , stir together all ingredients except bread and veggies', 'refrigerate at least 2 hours', 'cut thin , lengthwise slice off of top of bread', 'hollow out center of bread , reserving bread to use for dipping , and leaving 1-inch shell', 'fill with dip', 'serve with reserved bread and veggie dippers']","my family loves reuben's, so this is a fave munchie around here. it is also good served with crackers if you don't want to do the whole bread thing. great party food!!","['sour cream', 'thousand island dressing', 'green onion', 'swiss cheese', 'corned beef', 'sauerkraut', 'caraway seeds', 'pumpernickel bread', 'vegetables']",9
crock pot creamy chicken noodle soup,435,"['weeknight', 'time-to-make', 'course', 'main-ingredient', 'preparation', 'occasion', 'soups-stews', 'poultry', 'chicken', 'crock-pot-slow-cooker', 'comfort-food', 'meat', 'taste-mood', 'equipment']","[286.4, 20.0, 11.0, 61.0, 40.0, 32.0, 6.0]",4,"['put the 1st ingredients in the crock-pot', 'cook 6 hours on low setting', 'add frozen peas and noodles cook on low setting 1 hour or until noodles are done', 'stir in sour cream and garnish with parsley']",this soup is really tasty and makes the house smell good.,"['carrot', 'celery', 'onion', 'mushroom pieces', 'cooked chicken', 'chicken broth', 'condensed cream of chicken with herbs soup', 'dried marjoram', 'dried thyme', 'pepper', 'salt', 'frozen peas', 'medium egg noodles', 'sour cream', 'fresh parsley']",15
my favourite sweet toasted vermicelli for ramadan,37,"['60-minutes-or-less', 'time-to-make', 'course', 'main-ingredient', 'cuisine', 'preparation', 'occasion', 'breakfast', 'fruit', 'pasta', 'asian', 'easy', 'holiday-event', 'kid-friendly', 'vegetarian', 'stove-top', 'dietary', 'ramadan', 'inexpensive', 'tropical-fruit', 'pasta-rice-and-grains', 'equipment', '3-steps-or-less']","[266.1, 6.0, 55.0, 0.0, 13.0, 10.0, 16.0]",7,"['break the vermicelli in half', 'place the ghee , rose water , sugar , cardamom & saffron in a large pan', 'heat through gently then add the vermicelli', 'mix very well to coat thoroughly & to break up a little', 'cook on as low heat as possible for approx 25-30 minutes or until the vermicelli is glossy & has absorbed everything', 'at this point , stir in the mixed fruit & nuts', 'serve']","i do have another recipe for seviyan posted, but that is a creamier more dessert like dish. i prefer this one as it is not as sweet & is brilliant for suhor (the meal before dawn). seviyan is the name of the toasted vermicelli used to make sweets aswell as savoury dishes in countries such as pakistan & india. it is eaten throughout the year but comes into it's own during ramadan. you can buy seviyan / toasted vermicelli at most asian stores & you can find it in the international isle of the larger supermarkets. otherwise you can toast your own fine vermicelli in the oven! the fruit & nuts i refer to is the tropical dried fruit & nut mix you buy which typically has coconut, papaya, pineapple, banana, raisins & peanuts. if you don't want to use this then you can use slivered almonds & roughly chopped pistachios instead.","['vermicelli', 'sugar', 'mixed nuts and dried fruit', 'ground cardamom', 'rose water', 'ghee', 'saffron']",7
biscuits made easy,20,"['30-minutes-or-less', 'time-to-make', 'course', 'main-ingredient', 'cuisine', 'preparation', 'occasion', 'north-american', '5-ingredients-or-less', 'breads', 'eggs-dairy', 'american', 'southern-united-states', 'easy', 'beginner-cook', 'rolls-biscuits', 'dietary', 'high-calcium', 'high-in-something', 'brunch']","[253.8, 16.0, 0.0, 22.0, 10.0, 10.0, 10.0]",5,"['preheat oven to 350', 'mix together with fingers', 'pinch off - roll into balls', 'top with oil before cooking', 'cook for 10-15 minutes']",this is my aunt ginny's recipe.  i always wondered how she could whip up homemade biscuits so quickly and finally she let me in on her secret.  the key is to buy really great quality flour.,"['self rising flour', 'cooking oil', 'milk']",3
lamb stew with pasta,85,"['time-to-make', 'course', 'main-ingredient', 'cuisine', 'preparation', 'main-dish', 'lamb-sheep', 'pasta', 'vegetables', 'easy', 'european', 'diabetic', 'dietary', 'low-saturated-fat', 'low-calorie', 'low-carb', 'low-in-something', 'meat', 'pasta-rice-and-grains', '3-steps-or-less', '4-hours-or-less']","[435.1, 27.0, 35.0, 36.0, 87.0, 23.0, 8.0]",11,"['in a large saucepan cook the lamb and onion in hot oil until the meat is brown', 'stir water , dried tomatoes , italian seasoning , salt , and pepper into the saucepan', 'bring to boiling', 'reduce heat', 'simmer , covered , about 45 minutes or until the meat is nearly tender', 'stir mushrooms , green beans , carrot , and pasta into meat mixture', 'return to boiling', 'reduce heat', 'simmer , covered , for 15 minutes more or until meat , vegetables , and pasta are tender', 'stir in tomato sauce', 'heat through']",this is comfort food and a meal in a pot. all you need is some good quality bread. it was shared with me by a new neighbor when we were getting acquainted so i call it donna's stew. i must admit that i use canned green beans (drained) because i dislike frozen ones.,"['lamb stew meat', 'onion', 'cooking oil', 'water', 'dried tomatoe', 'dried italian seasoning', 'salt', 'black pepper', 'fresh mushrooms', 'frozen cut green beans', 'carrot', 'bow tie pasta', 'tomato sauce']",13
stuffed french toast strata with orange syrup,60,"['60-minutes-or-less', 'time-to-make', 'course', 'main-ingredient', 'preparation', 'breakfast', 'eggs-dairy', 'fruit', 'citrus', 'oranges']","[469.1, 17.0, 153.0, 13.0, 21.0, 25.0, 28.0]",12,"['for french toast ~ spray 13""x9"" baking dish with cooking spray', 'toast 6 slices of the bread , then place in pan', 'spread each slice of toast evenly with cream cheese & marmalade', 'butter remaining bread slices , then place them butter-sides up on toast', 'in a medium bowl , with wire whisk , beat eggs , milk & vanilla until blended , then pour over bread', 'cover with aluminum foil & refrigerate at least 6 hours or overnight', 'when ready to proceed , preheat oven to 350 degrees f', 'uncover & bake 35-45 minutes or untild eep golden brown & slightly puffed', 'cut into slices , & place on individual serving plates', 'for orange syrup ~ in small microwavable bowl , mix corn syrup & oj concentrate', 'microwave uncovered on high about 1 minute or until heated', 'spoon over french toast & enjoy !']","the recipe for this very tasty strata came from the betty crocker holiday cookbooklet, dec 2003. preparation time does not include the 6 hours needed to set in refrigerator before baking!","['cinnamon raisin bread', 'neufchatel cheese spread with pineapple', 'orange marmalade', 'unsalted butter', 'eggs', 'whole milk', 'vanilla extract', 'light corn syrup', 'frozen orange juice concentrate']",9
curried lamb burgers with grilled vegetables and mint raita,52,"['60-minutes-or-less', 'time-to-make', 'course', 'main-ingredient', 'preparation', 'main-dish', 'lamb-sheep', 'meat']","[692.0, 65.0, 29.0, 42.0, 62.0, 78.0, 15.0]",34,"['for raita:', 'mix yogurt , mint , cilantro , and lime peel in small bowl', 'season to taste with coarse salt and pepper', 'cover', 'chill until cold , at least 30 minutes and up to 4 hours', 'for burgers and vegetables:', 'heat 2 tablespoons oil in large skillet over medium heat', 'add onion , ginger , and 1 / 2 teaspoon coarse salt', 'saut until onion is tender , about 8 minutes', 'mix in curry powder and stir 30 seconds', 'remove from heat', 'cool onion mixture to room temperature , at least 15 minutes', 'place lamb in large bowl', 'add onion mixture , 1 teaspoon coarse salt , cilantro , and 1 teaspoon cracked pepper', 'blend mixture gently', 'shape into six 1 / 2-inch-thick patties', 'prepare barbecue', 'combine zucchini , green onions , and chile in another large bowl', 'add 2 tablespoons oil , 1 / 2 teaspoon coarse salt , and 1 / 2 teaspoon cracked pepper', 'toss to coat', 'place vegetables and burgers on grill', 'cook until grill marks appear , about 4 minutes', 'turn vegetables and burgers over', 'cook vegetables until tender , about 3 minutes', 'cook burgers to desired doneness , about 4 minutes for medium-rare', 'cut zucchini and green onions crosswise into 2-inch-long pieces', 'cut chile into thin strips', 'place breads on plates', 'top with burgers and tomato slices', 'mound vegetables on burgers', 'spoon dollop of raita over', 'fold bread up around burgers and serve with remaining raita', 'often called a pasilla', 'available at some supermarkets and at specialty foods stores and latin markets']",from the latest bon apptit magazine. this looked like a great recipe for a weekend bbq.,"['plain yogurt', 'of fresh mint', 'fresh cilantro', 'lime peel', 'kosher salt', 'olive oil', 'onions', 'fresh ginger', 'madras curry powder', 'ground lamb', 'cracked black pepper', 'zucchini', 'green onions', 'poblano chile', 'pita breads', 'tomatoes']",16
greek galaktoboureko,120,"['weeknight', 'time-to-make', 'course', 'main-ingredient', 'cuisine', 'preparation', 'occasion', 'pies-and-tarts', 'desserts', 'eggs-dairy', 'greek', 'oven', 'european', 'dinner-party', 'heirloom-historical', 'holiday-event', 'kid-friendly', 'spring', 'vegetarian', 'easter', 'grains', 'eggs', 'stove-top', 'dietary', 'christmas', 'seasonal', 'valentines-day', 'pasta-rice-and-grains', 'equipment', 'number-of-servings', '4-hours-or-less']","[337.7, 21.0, 101.0, 7.0, 16.0, 38.0, 14.0]",20,"['to make the syrup , place all syrup ingredients in a saucepan and bring to a boil', 'cook for 10 minutes , skimming off any foam', 'remove from heat and cool', 'to prepare the custard , place milk and sugar in a small saucepan and heat until very hot', 'stir in cream of wheat , then add butter and salt', 'cook until thickened and smooth , stirring constantly , then remove from heat and allow to cool to room temperature', 'beat together eggs and vanilla in a large bowl until light and fluffy', 'stir in cooled custard and mix thoroughly', 'preheat oven to 350 degrees f', 'to prepare pastry , grease an 11x17-inch baking pan with butter', 'unwrap phyllo , laying out flat , and covering with damp towels when not getting pastry', 'lay 1 sheet of phyllo across the baking sheet and brush with butter', 'repeat with more sheet of phyllo to make an 8-sheet layer', 'pour the custard on top of the 8 buttered sheets and spread it out evenly with a spatula', 'repeat the process of the phyllo , covering the custard with 8 more buttered sheets', 'when you have those done , take a sharp knife a punch some breathing holes in the top', 'place the galaktoboureko in a preheated oven and bake for 45-60 min , or until custard is set and the pastry shakes loose from the edges of the pan', 'allow the galaktaboureko to cool about 30 minutes , thenpour the syrup evenly over the pastry', 'allow it to cool completely before cutting and serving', 'serves up to 48 , depending on size']","this is my husband's favorite greek dessert. it is like a baklava, except there is custard inside, all nice and ewwy-gooey. he gets all ewwy-gooey, too when he has this.","['sugar', 'water', 'orange rind', 'orange flower water', 'orange juice', 'milk', 'cream of wheat', 'unsalted butter', 'eggs', 'vanilla', 'salt', 'phyllo dough']",12
warm mushroom and chicken salad,35,"['60-minutes-or-less', 'time-to-make', 'course', 'main-ingredient', 'preparation', 'lunch', 'main-dish', 'poultry', 'vegetables', 'chicken', 'stove-top', 'dietary', 'mushrooms', 'meat', 'equipment']","[374.7, 36.0, 24.0, 44.0, 56.0, 17.0, 3.0]",17,"['sprinkle chicken with salt and pepper', 'in a large skillet over medium-high heat , heat oil until hot', 'add chicken and carrots', 'cook , stirring frequently , until chicken is opaque but still pink , about 2 minutes', 'add mushrooms', 'cook , stirring constantly , until mushrooms are softened , about 2 minutes', 'stir in wine', 'cook about 1 minute', 'using a slotted spoon , remove chicken and vegetable mixture to a serving bowl', 'set aside', 'heat juices in skillet over high heat until reduced to 1 t , about 3 minutes', 'pour over reserved chicken and mushroom mixture', 'cool slightly , about 5 minutes', 'just before serving add cucumbers and toss with tarragon salad dressing', 'serve on lettuce leaves', 'tarragon salad dressing: in a small bowl , combine oil , vinegar , mayo , tarragon , salt and pepper', 'mix well before using']",i think this came from meals.com,"['boneless skinless chicken breast', 'salt', 'pepper', 'olive oil', 'baby carrots', 'fresh mushrooms', 'white wine', 'cucumbers', 'white wine vinegar', 'mayonnaise', 'tarragon leaf', 'ground pepper']",12
chicken  basque style,85,"['time-to-make', 'course', 'main-ingredient', 'preparation', 'healthy', 'main-dish', 'poultry', 'vegetables', 'chicken', 'dietary', 'low-cholesterol', 'low-carb', 'inexpensive', 'healthy-2', 'low-in-something', 'meat', 'chicken-thighs-legs', 'peppers', 'tomatoes', '4-hours-or-less']","[602.1, 54.0, 47.0, 58.0, 52.0, 35.0, 14.0]",12,"['sprinkle chicken generously with salt', 'in a deep pan or stockpot heat 3 tablespoons olive oil over high heat', 'add the chicken and cook for 10 minutes , turning once , until it is lightly browned on all sides , set aside , keep warm', 'in the meantime , in another skillet , heat remaining olive oil over medium heat', 'cook the garlic for about 1 minute until it turns golden , then add the onion', ""saute' for about 5-10 minutes , until it is softened"", 'add the peppers , tomatoes and tomato paste , mix well and season with salt and sugar', 'cook , stirring for about 15 minutes , until the tomatoes release their liquid add beans', 'add the pepper- tomato mixture and the wine to the chicken and mix well', 'partially cover the pan and cook over medium heat for about 40 minutes , until the sauce thickens and the chicken is cooked through', 'gently stir in the lemon juice and cook 5 more minutes', 'serve chicken and sauce garnishend with parsley']","i recently found this recipe in a local newspaper. i made it that same night, and loved it. i used boneless, skinless chicken thighs in this recipe and that worked out wonderfully. it may seem like a long cooking time, but this is well worth the effort.","['chicken thighs', 'coarse salt', 'olive oil', 'garlic cloves', 'onion', 'bell peppers', 'diced tomatoes', 'tomato paste', 'salt', 'sugar', 'dry white wine', 'white beans', 'lemon, juice of', 'flat leaf parsley']",14
penne with rustic lentil sauce,25,"['30-minutes-or-less', 'time-to-make', 'course', 'main-ingredient', 'cuisine', 'preparation', 'occasion', 'healthy', 'main-dish', 'beans', 'pasta', 'asian', 'middle-eastern', 'easy', 'fall', 'dietary', 'low-sodium', 'low-cholesterol', 'seasonal', 'low-saturated-fat', 'comfort-food', 'inexpensive', 'lentils', 'healthy-2', 'low-in-something', 'pasta-rice-and-grains', 'penne', 'taste-mood', 'presentation', 'served-hot']","[710.9, 36.0, 35.0, 17.0, 45.0, 18.0, 35.0]",10,"['boil the chicken stock in a large saucepan for 10 minutes , or until it has reduced to 2 cups of liquid', 'meanwhile , cook the pasta in a large saucepan of rapidly boiling water until al dente', 'drain and toss with 2 tablespoons of olive oil', 'heat the remaining oil in a large deep frying pan , add the carrot , onion and celery and cook over medium heat for 10 minutes , or until lightly browned', 'add two thirds of the crushed garlic and the thyme and cook for a further minute', 'add the stock , and bring to boil and cook gently for 8 minutes , or until reduced slightly and the vegetables are tender', 'gently add the lentils and stir until heated through', 'stir in the remaining garlic and a little extra thyme , and season with plenty of cracked black pepper and sea salt', 'the stock should be slightly syrupy at this point', 'combine the pasta with the lentil sauce in a large bowl , drizzle generously with olive oil and serve with grated parmesan if liked']",a healthy meatless pasta....but one everyone seems to enjoy it.,"['chicken stock', 'penne pasta', 'virgin olive oil', 'extra virgin olive oil', 'onion', 'carrots', 'celery', 'garlic', 'fresh thyme', 'lentils']",10
