name,minutes,tags,nutrition,n_steps,steps,description,ingredients,n_ingredients
garlic lemon salmon potato bake,60,"['60-minutes-or-less', 'time-to-make', 'course', 'main-ingredient', 'preparation', 'for-1-or-2', 'casseroles', 'main-dish', 'potatoes', 'seafood', 'vegetables', 'oven', 'salmon', 'fish', 'food-processor-blender', 'one-dish-meal', 'saltwater-fish', 'equipment', 'small-appliance', 'number-of-servings']","[698.4, 59.0, 16.0, 5.0, 54.0, 30.0, 20.0]",11,"['in a mini-processor , puree marinade contents', 'pour marinade over steaks & marinate in refrigerator 1 / 2 hour', 'meanwhile , boil potatoes just until al dente & slice thin', 'spray a baking dish with olive oil spray', 'place sliced potatoes in baking dish and sprinkle a small amount of the marinade over them', 'top with salmon steaks', 'pour the rest of the marinade over the steaks and scatter the capers over the whole dish', 'bake at 400f 10 minutes and test for doneness--when cut into , flesh should be opaque but not yet flaking', 'if necessary , bake longer , testing every couple minutes', 'it should not take longer than 15 minutes', 'place a bed of greens on each of two dinner plates , place half the potatoes and a salmon steak on each bed of greens , dribble any marinade left in pan over the top and sprinkle with parsley']","a warm and delicious one-dish hot dinner for two. be sure to use highly flavor olive oil in the marinade; you can use a cheaper, lighter flavored oil to spray the pan with. for the spray, you can use pam or similar commerical olive oil nonstick spray, or simply put some olive oil in an oil atomizer if you have one. you can peel the potatoes before slicing if you want; i don't do this because i like them skin on, which also adds a bit more color to the dish. you can substitute about 6 little red-skinned new potatoes for the two large potatoes, if you prefer.","['salmon steaks', 'red potatoes', 'olive oil flavored cooking spray', 'capers', 'mixed baby greens', 'fresh parsley', 'extra virgin olive oil', 'lemon juice', 'garlic cloves', 'pepper']",10
protein powder brownies,25,"['30-minutes-or-less', 'time-to-make', 'course', 'preparation', 'desserts', 'easy', 'cookies-and-brownies', '3-steps-or-less']","[118.9, 2.0, 37.0, 7.0, 13.0, 1.0, 6.0]",3,"['mix everything', 'pour into well greased 13x9 pan', 'bake at 350 degrees for 20 minutes']",getting some nutritional stats,"['egg whites', 'low fat cottage cheese', 'rolled oats', 'whey protein powder', 'vanilla', 'baking powder', 'salt', 'sugar', 'cocoa', 'water']",10
alambre de camarones  grilled shrimp skewers,30,"['30-minutes-or-less', 'time-to-make', 'course', 'main-ingredient', 'preparation', 'appetizers', 'main-dish', 'seafood', 'easy', 'shrimp', 'dietary', 'low-saturated-fat', 'low-calorie', 'low-carb', 'low-in-something', 'shellfish']","[93.6, 6.0, 18.0, 21.0, 13.0, 2.0, 2.0]",11,"['marinade: add first 7 ingredients into a blender or food processor and blend until smooth', 'marinade shrimp for 10 minutes or up to 2 hours', 'skewers: cut onion into bite-sized chunks', 'add 1 chili to skewer', 'add 1 shrimp , a chunk of onion and a cherry tomato on to each skewer', 'repeat two times', 'add second chili to end of skewer', 'season with salt', 'heat the electric or gas grill over high heat', 'place skewers on grill and close grill cover', 'cook skewers for about 5 minutes on each side until the onions are tender and the shrimp is cooked through']","i saw this recipe on the self magazine website.  looks fabulous - would make such a nice pool side treat this summer!  i thought i would store it here for safe keeping.  if you try it, please let me know what you think!  i'll keep you posted, if i get a chance to make these anytime soon!","['garlic cloves', 'olive oil', 'fresh lime juice', 'worcestershire sauce', 'dried oregano', 'salt', 'fresh ground black pepper', 'bamboo skewers', 'shrimp', 'red onion', 'serrano chilies', 'cherry tomatoes']",12
roasted garlic and three cheese spread,50,"['60-minutes-or-less', 'time-to-make', 'course', 'preparation', 'appetizers', 'vegetarian', 'dips', 'spreads', 'dietary', 'high-calcium', 'high-protein', 'low-carb', 'high-in-something', 'low-in-something']","[62.3, 4.0, 4.0, 9.0, 12.0, 9.0, 0.0]",10,"['cut off top of garlic bulb to expose cloves', 'spray garlic lightly with cooking spray and wrap in aluminum foil', 'bake at 400f until very tender about 30 to 40 minutes', 'cool slightly and gently press cloves to remove from skins', 'mash cloves with fork', 'mix cheeses , garlic , and white pepper in medium bowl , adding milk 1 tablespoon at a time', 'add just enough milk to make desired spred consistency', 'refrigerate a minimum 3 to 24 hours', 'best if chilled 24 hours', 'spoon into serving bowl and serve with veggie and croustades or wheat thins']","good with veggies, croustades and wheat thins. **this needs to be made a day ahead for flavors to blend.**","['bulb of garlic', 'fat free cream cheese', 'goat cheese', 'parmesan cheese', 'white pepper', 'skim milk']",6
orange pecan gem cookies,23,"['30-minutes-or-less', 'time-to-make', 'course', 'preparation', 'occasion', 'for-large-groups', 'drop-cookies', 'desserts', 'potluck', 'cookies-and-brownies', 'taste-mood', 'sweet', 'to-go', 'number-of-servings']","[149.5, 13.0, 36.0, 5.0, 3.0, 7.0, 5.0]",9,"['preheat oven to 350 degrees , and grease baking sheets', 'combine cake mix , yogurt , egg , butter , and chopped pecans in a large bowl', 'beat at low speed with electric mixer until blended', 'drop by rounded teaspoonfuls , 2 inches apart , on prepared baking sheets', 'press a pecan half into the center of each cookie', 'bake for 11-13 minutes , or until golden brown', 'cool for 1 minute on baking sheets , then remove to cooling racks and cool completely', 'store in airtight container', 'makes 4 1 / 2 - 5 dozen cookies']",these sound really yummy to go on any cookie tray :),"['orange cake mix', 'low-fat vanilla yogurt', 'egg', 'butter', 'pecans', 'pecan halves']",6
rye bread sandwiches with tuna  pickle and cream cheese,10,"['15-minutes-or-less', 'time-to-make', 'course', 'main-ingredient', 'preparation', 'lunch', 'seafood', 'easy', 'fish', 'dietary', 'sandwiches', 'tuna', 'saltwater-fish', 'presentation', 'served-cold', '3-steps-or-less']","[352.6, 12.0, 18.0, 53.0, 65.0, 14.0, 12.0]",4,"['drain the tuna and mix with the grated lemon rind , lemon juice , pickles and cheese', 'season to taste with salt and pepper', 'spread mixture over 4 slices of rye bread and top with sliced onion and lettuce leaves and top with remaining slices of rye bread', 'cut in half to serve']",a tasty tuna sandwich which is low in fat.,"['tuna in water', 'lemon, rind of', 'lemon, juice of', 'pickles', 'reduced-fat cream cheese', 'rye bread', 'red onion', 'lettuce leaf']",8
warm cranberry glazed brie,25,"['30-minutes-or-less', 'time-to-make', 'course', 'main-ingredient', 'preparation', 'occasion', 'appetizers', 'eggs-dairy', 'easy', 'beginner-cook', 'holiday-event', 'dips', 'spreads', 'cheese', 'dietary']","[193.4, 17.0, 53.0, 10.0, 16.0, 33.0, 4.0]",11,"['preheat oven to 350 degrees f', 'with sharp knife , cut circle in top of rind of cheese , leaving 1 / 4-inch border around top of cheese', 'carefully remove center circle and discard', 'place cheese on pie plate or other small shallow ovenproof baking dish', 'in small saucepan , stir together cranberry sauce , sugar , ginger , orange zest , cornstarch and allspice', 'stir over medium heat until mixture comes to a boil and thickens slightly', 'remove from heat', 'spread cranberry mixture on top of cheese', 'bake 5 to 10 minutes , until cheese is soft but not runny', 'sprinkle with nuts and chives', 'serve with toasteds crackers']",i got this from the keebler website. i think it sounds delicious served as an appetizer for thanksgiving,"['brie cheese', 'whole berry cranberry sauce', 'granulated sugar', 'ginger', 'orange zest', 'cornstarch', 'ground allspice', 'pistachios', 'fresh chives']",9
banana chocolate chip muffins,30,"['30-minutes-or-less', 'time-to-make', 'course', 'main-ingredient', 'preparation', 'occasion', 'low-protein', 'healthy', 'very-low-carbs', 'breads', 'fruit', 'easy', 'muffins', 'chocolate', 'dietary', 'low-sodium', 'low-cholesterol', 'low-saturated-fat', 'low-calorie', 'low-carb', 'quick-breads', 'low-in-something', 'tropical-fruit', 'bananas', 'brunch', '3-steps-or-less']","[231.7, 9.0, 111.0, 5.0, 5.0, 18.0, 14.0]",7,"['preheat oven to 375 / 190c', 'mash bananas in a bowl and add rest of the ingredients', 'stir just until blended', 'it seems as if there is not enough liquid but dont be fooled', 'the very ripe bananas add all the moisture needed', 'mixing the ingredients together with a fork for 2-3 minutes is all you need to create the batter', 'bake for 20-25 minutes at 400f / 200c , in center of oven']",yum yum yum :p,"['bananas', 'butter', 'sugar', 'flour', 'baking soda', 'chocolate chips']",6
chili lime grilled chicken,40,"['60-minutes-or-less', 'time-to-make', 'course', 'main-ingredient', 'preparation', 'for-1-or-2', 'main-dish', 'poultry', 'barbecue', 'chicken', 'meat', 'grilling', 'number-of-servings', 'technique']","[378.9, 41.0, 1.0, 4.0, 61.0, 28.0, 0.0]",5,"['combine marinade ingredients', 'trim chicken and toss to coat in marinade', 'let stand at least 20 minutes', 'place on preheated , greased grill', 'cook , turning occasionally , until no longer pink but still tender']","a recipe inspired by chili lime grilled corn on the cob, an excellent pairing. nothing like the flavor of lime to celebrate summer.","['chicken breasts', 'olive oil', 'garlic cloves', 'chili powder', 'lime juice', 'tequila', 'salt and pepper']",7
allergen free gluten free bread,80,"['time-to-make', 'course', 'preparation', 'breads', 'dietary', 'gluten-free', 'egg-free', 'yeast', 'free-of-something', '4-hours-or-less']","[1210.1, 65.0, 92.0, 100.0, 41.0, 30.0, 65.0]",25,"['1', 'mix 1t honey and warm water', 'water should feel warm-to-hot to the touch but not burning', '2', 'add yeast and mix well', 'let the mixture sit until it gets bubbly / frothy', '3', 'mix all dry ingredients together', '4', 'when yeast liquid is frothy , add to dry ingredients', '5', 'add olive oil , 2t honey , cider vinegar and mixed egg replacer and beat until a smooth batter forms', 'dough should be along the consistency of cookie dough , not like wheat bread dough', '6', 'scrape into a lightly oiled loaf pan and smooth with wet fingers or spatula', '7', 'loosely cover pan', '8', 'preheat over to 350 and put loaf pan on top of stove other other warm place to rise', '9', 'let rise 20 minutes for rapid rise yeast and 30ish minutes for regular yeast', '10', 'bake 35-45 minutes', '11', 'cool on wire rack']",an absolutely amazing gf bread from http://glutenfreegoddess.blogspot.com perfect taste and texture.,"['sorghum flour', 'potato starch', 'millet flour', 'xanthan gum', 'salt', 'yeast', 'warm water', 'olive oil', 'honey', 'egg beaters egg substitute', 'rice vinegar']",11
rocky road whoppers,14,"['15-minutes-or-less', 'time-to-make', 'course', 'preparation', 'drop-cookies', 'desserts', 'cookies-and-brownies', 'dietary', 'low-sodium', 'low-in-something']","[245.8, 21.0, 103.0, 2.0, 5.0, 33.0, 10.0]",11,"['preheat oven to 350f line 2 baking sheets with parchment paper , stir flour , baking powder and salt in small bowl to blend', 'set aside', 'stir 1 cup chocolate chips and butter in medium bowl set over saucepan of barely simmering water until melted and smooth', 'transfer chocolate mixture to a large bowl , set aside', 'whisk sugar , egg , coffee mixture and vanilla in medium bowl until blended', 'stir egg mixture into reserved chocolate mixture', 'mix in flour mixture just until blended', 'add nuts and remaininig 1 cup chocolate chips', 'for each cookie , drop 1 rounded tablespoon dough onto prepared baking sheet , spacing 3-inches apart', 'gently press 5 marshmallows into center of each', 'gently press 1 rounded tablespoon dough atop each to cover marshmallows and form 2-inch high mounds , bake cookies until top is dull and feels crusty when touched gently , rotating baking sheets front to back and top to bottom halfway through baking to ensure even browning , about 14 minutes']","these big chocolate and walnut chocolate chip cookies have a center filled with miniature marshmallows,  the end result is a cookie marbled with chocolate and melted marshmallows.  lining the baking sheet with parchment paper makes these cookies easy to remove.","['all-purpose flour', 'baking powder', 'salt', 'semi-sweet chocolate chips', 'unsalted butter', 'sugar', 'egg', 'water', 'vanilla extract', 'walnuts', 'miniature marshmallows']",11
pork and mushroom coriander stir fry,35,"['60-minutes-or-less', 'time-to-make', 'course', 'main-ingredient', 'cuisine', 'preparation', 'occasion', 'main-dish', 'pork', 'asian', 'dinner-party', 'dietary', 'stir-fry', 'meat', 'technique']","[316.8, 26.0, 21.0, 24.0, 58.0, 19.0, 3.0]",7,"['combine coriander , ginger and chilli , rub into pork', 'combine fish sauce , lime juice and brown sugar and set aside whilst preparing pork', 'add pork in batches and stir fry for 1- 2 minutes stirring continuously', 'transfer to a plate and cover loosely to keep warm', 'cook onion for 2 minutes', 'add mushrooms , pork , snow peas , coriander and dressing and cook for 2- 3 minutes', 'serve with cooked noodles or rice']","healthy, tasty thai style pork stir-fry. always a hit with visitors.","['lean pork', 'coriander', 'ginger', 'chili paste', 'fish sauce', 'fresh lime juice', 'brown sugar', 'vegetable oil', 'onion', 'button mushroom', 'shiitake mushroom', 'snow peas']",12
scandanavian mustard and dill sauce finland,10,"['weeknight', '15-minutes-or-less', 'time-to-make', 'course', 'cuisine', 'preparation', 'occasion', 'low-protein', 'condiments-etc', 'scandinavian', 'easy', 'european', 'vegan', 'vegetarian', 'finnish', 'dietary', 'low-carb', 'low-in-something']","[1079.1, 175.0, 21.0, 124.0, 12.0, 72.0, 4.0]",10,"['chop up the dill till nice and fine', 'measure out the mustard into a small bowl', ""you can start by using a little less mustard to start with if you don't want it too strong"", 'add the vinegar', 'next , add the salt and sugar', 'toss on the chopped dill', 'next , whisk in the oil', 'you can add as much or as little as you like', 'keep tasting', 'enjoy with a slab of fresh grilled salmon , with fresh boiled or roasted potatoes , steamed carrots , alonside orzo , well , you get the idea']","this tangy, spicy scandinavian recipe goes great with meaty salmon. take the time to buy really excellent mustard  the spicier the better. if you have leftovers try spreading a little on a sandwich. from global table adventures.","['dijon mustard', 'fresh dill', 'vinegar', 'salt', 'sugar', 'oil']",6
godiva chocolate raspberry latte,5,"['15-minutes-or-less', 'time-to-make', 'course', 'main-ingredient', 'preparation', 'for-1-or-2', 'beverages', 'chocolate', 'number-of-servings']","[59.1, 5.0, 0.0, 2.0, 6.0, 10.0, 1.0]",6,"['pour raspberry syrup into a 12-ounce cup', 'add espresso shot', 'immediately add at least a tablespoon of steamed milk', 'whisk in dark chocolate cocoa mix until dissolved', 'mix in the remaining steamed milk', 'garnish with whipped cream and dust with cocoa , if desired']","i made the classic mocha even better by using godiva dark chocolate truffle hot cocoa mix, available at godiva retailers.  the sweetness of the raspberry blends well with the slightly bitter taste of the dark chocolate.  can also be made with godiva classic milk chocolate hot cocoa mix.","['raspberry flavored syrup', 'espresso', 'milk', 'godiva dark truffle hot cocoa powder', 'whipped cream', 'cocoa']",6
afghani meat and fish spice rub,10,"['15-minutes-or-less', 'time-to-make', 'course', 'cuisine', 'preparation', '5-ingredients-or-less', 'condiments-etc', 'asian', 'easy', 'marinades-and-rubs', 'dietary', 'low-sodium', 'low-cholesterol', 'high-calcium', 'high-fiber', 'healthy-2', 'high-in-something', 'low-in-something', '3-steps-or-less']","[647.2, 34.0, 12.0, 5.0, 49.0, 17.0, 40.0]",2,"['use a mortar and pestle to grind all the ingredients together , or use a spice grinder', 'store in an airtight container']","this combination is good on any fish or any meat of your choosing.  it was developed by an afghan street vendor in nyc, zvia.  he rubs the blend all over beef, pork, or chicken 2 hours before grilling.  he also likes it on tuna, swordfish, bluefish, and bass.  it will give you a blackened effect.  it is also delicious stirred into rice or soup.","['black peppercorns', 'cumin seeds', 'ground turmeric', 'ground cardamom', 'ground coriander']",5
gluten free lebanese tabbouleh  using quinoa,35,"['60-minutes-or-less', 'time-to-make', 'course', 'main-ingredient', 'preparation', 'main-dish', 'side-dishes', 'vegetables', 'easy', 'vegan', 'vegetarian', 'grains', 'dietary', 'one-dish-meal', 'low-sodium', 'low-cholesterol', 'healthy-2', 'low-in-something', 'pasta-rice-and-grains', 'onions', 'tomatoes', '3-steps-or-less']","[354.1, 32.0, 16.0, 0.0, 15.0, 14.0, 12.0]",3,"['combine all ingredients together in a large serving bowl', 'taste and adjust seasoning with salt , pepper and lemon juice', 'let flavours meld for a while and serve at room temperature or chilled']","this flavourful salad can stand alone as a vegetarian main dish, thanks to quinoa's protein content, or be served as a side dish or sandwich filling in a pita. enjoy!","['quinoa', 'flat leaf parsley', 'green onions', 'grape tomatoes', 'cucumber', 'lemon, juice of', 'extra virgin olive oil', 'sea salt']",8
warm frisee salad with fingerlings and bacon,60,"['bacon', '60-minutes-or-less', 'time-to-make', 'course', 'main-ingredient', 'cuisine', 'preparation', 'occasion', 'north-american', 'salads', 'pork', 'potatoes', 'vegetables', 'oven', 'easy', 'european', 'roast', 'dinner-party', 'holiday-event', 'stove-top', 'meat', 'greens', 'lettuces', 'taste-mood', 'equipment', 'presentation']","[484.7, 51.0, 9.0, 72.0, 49.0, 45.0, 7.0]",14,"['preheat oven to 400f', 'toss potatoes with 2 tablespoons olive oil , thyme and 1 teaspoon salt in medium bowl', 'arrange potatoes in roasting pan', 'cover pan with foil', 'roast until tender when pierced with fork , about 40 minutes', 'cool 10 minutes , then cut potatoes in half lengthwise', 'meanwhile , toss frise , dandelion greens and parsley in large bowl', 'whisk vinegar and remaining 2 tablespoons olive oil in small bowl to blend', 'saut bacon in heavy , large skillet over medium-high heat until golden brown , about 5 minutes', 'reduce heat to medium', 'add shallots and potatoes to skillet and saut 2 minutes', 'add vinegar mixture and swirl pan until heated through', 'season to taste with salt and pepper', 'pour bacon mixture over greens , toss to coat and serve']",mmmm... too many good ingredients! sandi does a nose dive into the platter!,"['fingerling potato', 'extra virgin olive oil', 'fresh thyme', 'salt', 'frisee', 'dandelion greens', 'fresh italian parsley', 'sherry wine vinegar', 'smoked bacon', 'shallot']",10
cypriot split pea soup  louvana   gluten free   vegan,127,"['weeknight', 'time-to-make', 'course', 'main-ingredient', 'cuisine', 'preparation', 'occasion', 'healthy', 'soups-stews', 'beans', 'greek', 'european', 'low-fat', 'vegan', 'vegetarian', 'dietary', 'low-sodium', 'gluten-free', 'low-cholesterol', 'low-saturated-fat', 'low-calorie', 'comfort-food', 'inexpensive', 'lentils', 'healthy-2', 'free-of-something', 'low-in-something', 'taste-mood', 'presentation', 'served-hot', '4-hours-or-less']","[377.1, 15.0, 29.0, 0.0, 36.0, 6.0, 19.0]",15,"['pick over split peas , discarding any that are discoloured', 'wash in several changes of cold water', 'place in a deep pan and add the amount of water stated', 'put on medium heat and bring to a boil , skimming when necessary', 'when boiling reduce heat to low and cover pot and simmer gently for one hour without stirring', 'peel potatoes and cut into small dice leave in some cold water on the side so they do not dicolour', 'in a small pan fry onion in olive oil until lightly flecked with brown', 'add potatoes , onion and oil to split peas', 'cover and simmer for a further hour or until peas and potatoes are very soft', 'do not stir during cooking as this can cause scorching', 'when cooked stir in sea salt to taste and puree', 'serve in deep plates with lemon wedges to be squeezed to individual taste', 'additional olive oil is often drizzled onto the puree', 'serve with a side of fresh salad topped with gourmet black olives & feta for a lovely light meal', 'enjoy !']","this is delicious with a side of fresh salad (baby romaine topped with gourmet black olives & goat milk feta cheese) for a lovely light meal. this is even good without the potatoes, i sometimes add more water in as well. from the complete middle east cookbook by tess mallos.","['yellow split peas', 'water', 'potatoes', 'onions', 'olive oil', 'sea salt', 'lemon']",7
shrimp  asparagus  and white bean salad,30,"['30-minutes-or-less', 'time-to-make', 'course', 'main-ingredient', 'cuisine', 'preparation', 'occasion', 'north-american', 'healthy', 'main-dish', 'salads', 'beans', 'seafood', 'vegetables', 'american', 'low-fat', 'romantic', 'spring', 'summer', 'shrimp', 'stove-top', 'dietary', 'low-sodium', 'seasonal', 'low-saturated-fat', 'low-calorie', 'low-carb', 'low-in-something', 'shellfish', 'asparagus', 'taste-mood', 'equipment']","[473.0, 20.0, 14.0, 27.0, 87.0, 20.0, 15.0]",15,"['steam asparagus , covered , for 3 minutes', 'drain', 'plunge into an ice bath or rinse with cold water', 'sprinkle shrimp with 1 / 8 tsp pepper and 1 / 8 tsp salt', 'heat oil in skillet', ""add shrimp , saute' about 4 minutes or just until pink"", 'remove shrimp from pan to a large bowl', 'add asparagus , baby spinach , and beans to shrimp and toss well', 'in the same pan , cook the bacon over medium heat until crisp', 'add onions , and after one minute , add garlic', 'cook two minutes or until the onions are soft , stirring frequently', 'remove from heat', 'add the remaining salt& pepper , the bacon , chicken broth , parsley , lemon juice , & vinegar', 'drizzle the warm dressing over the salad', 'toss to coat well']",from cooking light magazine.,"['asparagus', 'medium shrimp', 'fresh ground black pepper', 'salt', 'baby spinach', 'cannellini beans', 'bacon', 'sweet onion', 'fresh garlic', 'chicken broth', 'fresh parsley', 'fresh lemon juice', 'apple cider vinegar']",13
crock pot chicken bbq,430,"['course', 'main-ingredient', 'preparation', 'healthy', 'main-dish', 'poultry', 'easy', 'low-fat', 'chicken', 'crock-pot-slow-cooker', 'dietary', 'low-saturated-fat', 'low-calorie', 'low-carb', 'low-in-something', 'meat', 'chicken-breasts', 'equipment']","[450.7, 9.0, 26.0, 61.0, 145.0, 6.0, 6.0]",7,"['put chicken , water , worcestershire sauce , vinegar and cumin in crock pot and set to low', 'cook 6 hours', 'drain juices', 'shred chicken right in crock pot using two forks to pull apart', 'pour in bbq sauce and stir to combine', 'cook on low for an additional hour', 'serve on buns with coleslaw !']",i got this recipe from an email newsletter i subscribe to.,"['boneless skinless chicken breasts', 'water', 'worcestershire sauce', 'vinegar', 'cumin', 'barbecue sauce']",6
spiced prawns,50,"['60-minutes-or-less', 'time-to-make', 'course', 'main-ingredient', 'preparation', 'healthy', 'lunch', 'main-dish', 'condiments-etc', 'seafood', 'easy', 'beginner-cook', 'finger-food', 'low-fat', 'herb-and-spice-mixes', 'shrimp', 'stove-top', 'dietary', 'low-saturated-fat', 'low-calorie', 'stir-fry', 'low-carb', 'cooking-mixes', 'low-in-something', 'shellfish', 'equipment', 'presentation', 'served-hot', '3-steps-or-less', 'technique']","[217.3, 8.0, 14.0, 61.0, 63.0, 4.0, 2.0]",3,"['shell and devein the prawns , leave the tails on if you want', 'combine all the ingredients for the marinade , add the prawns , mix well , cover , put in the fridge and marinate preferably overnight', 'when ready to cook , heat the oil in a non-stick pan and stir fry the prawns until cooked , you better do this in batches']","friendly on the waistline! finger food or a main dish served with noodles/rice and vegetables, a simple but very tasty dish. if you can't get lemon grass or lime leaves, the best substitute i can think of is to use grated lime zest. marinating time not included.","['prawns', 'garlic', 'lemongrass', 'ground coriander', 'ground cumin', 'teriyaki sauce', 'honey', 'shallots', 'hot sauce', 'peanut oil']",10
