name,minutes,tags,nutrition,n_steps,steps,description,ingredients,n_ingredients
twice  baked potato casserole,65,"['time-to-make', 'course', 'main-ingredient', 'preparation', 'occasion', 'casseroles', 'side-dishes', 'potatoes', 'vegetables', 'oven', 'easy', 'holiday-event', 'kid-friendly', 'dietary', 'low-sodium', 'independence-day', 'st-patricks-day', 'low-in-something', 'super-bowl', 'equipment', '4-hours-or-less']","[442.3, 41.0, 10.0, 15.0, 30.0, 76.0, 12.0]",12,"['preheat oven to 350 degrees', 'lightly grease a shallow 2-quart baking dish', 'cook potatoes in a large pot with salted water to cover for 20 to 25 minutes , until tender when pierced', 'drain well and return to pot', 'while potatoes are still hot , add butter and mash with a potato masher until smooth', 'stir in 1 cup of cheese , milk , sour cream and eggs until blended', 'then add 1 / 2 cup of scallions , 3 slices of bacon , crumbled', 'salt and pepper to taste', 'spoon into the prepared baking dish', 'sprinkle with remaining cheese and 2 slices of bacon , crumbled', 'bake uncovered for 35-40 minutes or until the top is lightly golden brown', 'sprinkle with remaining 1 / 4 cup of scallions and serve']",the flavour of twice-baked potatoes in an easy casserole dish (no cream soups!) for everyone to share.,"['potatoes', 'butter', 'cheddar cheese', 'milk', 'sour cream', 'eggs', 'scallions', 'bacon', 'salt and pepper']",9
pumpkin creme caramel,65,"['time-to-make', 'course', 'main-ingredient', 'preparation', 'occasion', 'desserts', 'vegetables', 'dinner-party', 'holiday-event', 'dietary', 'christmas', 'thanksgiving', 'low-sodium', 'low-in-something', 'squash', '4-hours-or-less']","[247.1, 14.0, 130.0, 4.0, 10.0, 20.0, 12.0]",14,"['heat oven to 350 degrees', 'sprinkle hazelnuts in bottoms of eight 6-oz', 'custard cups', 'heat granulated sugar and the water in heavy medium saucepan over medium-high heat to boiling', 'boil , without stirring but watching carefully , until amber in color', 'immediately pour over the hazelnuts', 'heat the milk in a small saucepan until scalded', 'whisk remaining ingredients in mixing bowl until completely blended', 'gradually whisk in milk and pour over caramel in cups', 'place custard cups in a large baking pan and pour hot water into the pan until it comes halfway up the sides of the cups', 'bake until the custards are set but centers are still slightly wobbly , about 35-40 minutes', 'remove cups from water bath and let cool to room temperature', 'refrigerate at least 6 hours overnight', 'to serve , invert each cup onto a dessert plate , then seve at once']","this is a delightful autumn dessert that is really not complicated at all.  it does require about 7 hours to cool and chill, which is not factored into the preparation time.","['hazelnuts', 'granulated sugar', 'water', 'milk', 'pumpkin puree', 'light brown sugar', 'eggs', 'unsalted butter', 'pumpkin pie spice', 'salt']",10
lemon zucchini cake with poppy seed,60,"['60-minutes-or-less', 'time-to-make', 'course', 'preparation', 'desserts', 'cakes']","[343.8, 30.0, 85.0, 17.0, 8.0, 14.0, 12.0]",10,"['in a large bowl combine sugar , oil , eggs , lemon extract , poppy seed and mix well', 'stir in shredded zucchini', 'combine in another bowl , flour , baking powder , baking soda and salt', 'mix well', 'gradually add this mixture to the zucchini mixture', 'mix throughly', 'pour into greased 9x13 pan', 'bake 350 for 40-50 minutes or until a tooth pick comes out clean', 'add a lemon glaze for the topping - 1 / 2 cup sugar , 1 teaspoon lemon extract , 1 tablespoon water', 'in a saucepan bring to a boil , when cake is warm , brush with glaze']",good tasting cake with lots of lemon flavor.,"['sugar', 'oil', 'eggs', 'lemon extract', 'poppy seeds', 'zucchini', 'flour', 'baking powder', 'baking soda', 'salt']",10
kaseropita  tiropita using kaseri cheese,110,"['weeknight', 'time-to-make', 'course', 'main-ingredient', 'cuisine', 'preparation', 'occasion', 'for-large-groups', 'savory-pies', 'appetizers', 'lunch', 'main-dish', 'snacks', 'eggs-dairy', 'greek', 'oven', 'european', 'dinner-party', 'kid-friendly', 'vegetarian', 'cheese', 'eggs', 'dietary', 'brunch', 'equipment', 'number-of-servings', '4-hours-or-less']","[261.6, 25.0, 0.0, 12.0, 13.0, 46.0, 6.0]",15,"['in a large metal baking pan , layer 1 / 2 of phyllo sheets , brushing each one generously with butter before adding next , and staggering across pan to get all corners covered', 'combine cheeses well and place in pan', 'spread out evenly', 'cover with remaining phyllo sheets , brushing each one generously with butter before adding next , and staggering across pan to get all corners covered', 'tuck in loose edges and brush top of pastry generously with more butter', 'with the', 'these act as steam vents', ""make sure you don't cut all the way into bottom layer of pastry- you just want to cut through the top layer"", 'pour over any remaining butter', 'combine milk with the eggs and beat well', 'pour over pastry and allow to sit , at room temperature for 30 minutes to absorb the custard', 'preheat oven to 375f', 'after 20 minutes , place pastry in oven and bake till golden-brown on top', 'for the last 10 minutes of baking , place pan on floor of oven to ensure a crisp , properly-baked bottom crust', 'allow to cool for at least 15 minutes before cutting pieces']",another version of the traditional greek cheese pie (tiropita).,"['phyllo pastry', 'butter', 'kasseri cheese', 'kefalotiri', 'milk', 'extra-large eggs']",6
basque cake,80,"['time-to-make', 'course', 'preparation', 'desserts', 'cakes', '4-hours-or-less']","[322.6, 24.0, 86.0, 6.0, 11.0, 39.0, 12.0]",28,"['pastry: preheat oven to 350 degrees f', 'sift together flours and baking powder', 'stir in ground almonds', 'in a food processor combine flour mixture with cold butter', 'pulse several times until mixture resembles coarse meal', 'in a small bowl whisk together whole egg , egg yolks and sugar until smooth', 'add to flour mixture and pulse again until mixture comes together', 'turn onto a lightly floured surface', 'divide dough in half', 'roll out each half into quarter inch thick 10-inch circles', 'cover with plastic wrap and chill for 30 minutes', 'pastry cream: in a medium bowl whisk together first amount of milk , egg yolks and cornstarch until smooth', 'heat second amount of milk , sugar and vanilla in a heavy bottomed pot', 'when this mixture comes to a boil , slowly pour half of it over the egg yolk mixture while whisking briskly', 'return mixture back to pot', 'continue whisking 4 to 5 minutes until smooth and boiling', 'remove from heat', 'add ground almonds', 'cover surface with plastic wrap', 'cool to room temperature', 'assembly', 'line a flan ring with one layer of the rolled pastry', 'pour in pastry cream and then top with second layer of pastry', 'place flan ring on baking sheet', 'bake for 40 to 45 minutes until golden and set', 'sour cherry sauce: combine all sauce ingredients in a small saucepan and bring to a boil', 'reduce to simmer and reduce by half', 'strain and serve warm over cake']",a great dessert for entertaining.,"['flour', 'cornflour', 'baking powder', 'ground almonds', 'butter', 'icing sugar', 'egg', 'egg yolks', 'whole milk', 'cornstarch', 'sugar', 'vanilla bean', 'red wine', 'red currant jelly', 'sour cherry', 'honey', 'cinnamon stick', 'whole cloves']",18
hot coleslaw with poppy seed dressing,23,"['30-minutes-or-less', 'time-to-make', 'course', 'main-ingredient', 'preparation', 'low-protein', 'healthy', 'salads', 'vegetables', 'easy', 'dietary', 'low-cholesterol', 'low-calorie', 'low-carb', 'healthy-2', 'low-in-something']","[181.3, 21.0, 36.0, 25.0, 3.0, 9.0, 4.0]",5,"['in large saucepan over medium-high heat , heat salad oil', 'cook cabbage , carrot and onion in hot oil until cabbage is tender-crisp , about 5 minutes , stirring occasionally', 'add vinegar , sugar , poppy seeds and salt', 'cook 2 minutes longer', 'serve']",this was one of great-grandma's recipes.,"['salad oil', 'green cabbage', 'carrot', 'onion', 'cider vinegar', 'sugar', 'poppy seeds', 'salt']",8
apple and cinnamon clafouti,35,"['60-minutes-or-less', 'time-to-make', 'course', 'main-ingredient', 'cuisine', 'preparation', 'healthy', 'desserts', 'fruit', 'european', 'kid-friendly', 'low-fat', 'dietary', 'low-sodium', 'low-saturated-fat', 'low-calorie', 'inexpensive', 'low-in-something', 'apples']","[209.3, 4.0, 108.0, 3.0, 13.0, 4.0, 13.0]",12,"['heat oven to 180 degrees celsius', 'grease 4 ovenproof ramekins', 'combine sugar and flour in bowl', 'whisk together eggs and milk', 'combine egg mixture with flour mixture', 'divide apple among ramekins', 'spoon custard over', 'sprinkle with cinnamon', 'put ramekins on oven tray', 'bake 25 minutes or until custard is set', 'stand 5 minutes', 'dust with icing sugar and serve']",this is a reasonably low fat version  of a classic french pudding from a magazine called super food ideas,"['caster sugar', 'plain flour', 'eggs', 'skim milk', 'pie apples', 'cinnamon', 'icing sugar']",7
sugee  suji  cake,60,"['60-minutes-or-less', 'time-to-make', 'course', 'cuisine', 'preparation', 'occasion', 'desserts', 'asian', 'oven', 'easy', 'beginner-cook', 'cakes', 'dietary', 'low-sodium', 'inexpensive', 'low-in-something', 'brunch', 'equipment']","[1138.5, 112.0, 249.0, 14.0, 42.0, 160.0, 34.0]",22,"['cream butter and 120g sugar for 1 minute in a mixer', 'add milk and semolina flour', 'mix well', 'set aside covered for an hour', 'preheat oven till 180 degrees celsius', 'grease sides and bottom of 7-inch round cake tin', 'line bottom of tin with paper', 'beat eggs and yolks in a mixer till frothy', 'add 120g sugar slowly', 'beat for 5 minutes', 'add vanilla essence and stir', 'sift flour , baking powder and salt', 'add ground almonds and chopped almonds', 'mix well', 'add 1 / 2 of egg mixture to butter mixture', 'fold gently', 'then add 1 / 2 of flour mixture to butter mixture and fold', 'repeat above step', 'do not overmix or the cake will turn out densely textured', 'pour mixture into cake tin and bake for 45 minutes', 'allow cake to cool for 10 minutes before removing from tin', 'recipe']","this fragrant and moist cake is rich, flavourful and studded with crunchy almond nibs. this is my tried and tested recipe and is one of my favourite cakes to bake! go to www.boostprints.com to view a picture of the cake.","['unsalted butter', 'caster sugar', 'milk', 'semolina flour', 'eggs', 'egg yolks', 'vanilla essence', 'all-purpose flour', 'baking powder', 'salt', 'ground almonds', 'almonds']",12
easy diet feast,11,"['15-minutes-or-less', 'time-to-make', 'course', 'main-ingredient', 'preparation', 'for-1-or-2', '5-ingredients-or-less', 'main-dish', 'beans', 'rice', 'easy', 'microwave', 'beginner-cook', 'vegan', 'vegetarian', 'dietary', 'inexpensive', 'black-beans', 'egg-free', 'free-of-something', 'pasta-rice-and-grains', 'brown-rice', 'equipment', 'number-of-servings', '3-steps-or-less']","[436.8, 3.0, 0.0, 38.0, 38.0, 2.0, 28.0]",4,"['put the frozen pepper & onion mixture in a microwave safe bowl and microwave for 2-3 minutes until hot', 'drain', 'in a larger serving bowl , stir together beans and rice , and microwave for 2-3 minutes', 'stir in peppers and onions , and salsa']","note: i'm trying to tweak this.  the calories are coming up way higher than they should (should be 400-500 depending on your salsa usage)  this is something that i've worked up recently.  the beans and rice should already be cooked.  if i were to eat all of this at lunchtime, i would still feel full around dinner.  you feel like you're stuffing yourself, but it's a modest amount of calories, low fat, low sodium (depends on the salsa), and an insane source of fiber.  very easy to throw together if you make larger batches of the beans and rice.

i do not used canned beans because of the sodium.  but if you use a pressure cooker, a whole bag of dry beans (not soaked) only takes 35-40 minutes to cook. 

i get the frozen pepper & onion mixture from kroger.

the salsa quantity is up to you, but you would save a few calories by reducing the amount (i like a lot).  my preferences are paul newman's pineapple or sam's choice pineapple peach chipotle, because it adds a nice sweetness to the mixture","['canned black beans', 'cooked brown rice', 'frozen peppers and onions', 'salsa']",4
everything but the kitchen sink breakfast casserole,65,"['time-to-make', 'course', 'preparation', 'occasion', 'breakfast', 'easy', 'brunch', '4-hours-or-less']","[456.8, 43.0, 16.0, 47.0, 45.0, 57.0, 9.0]",13,"['preheat oven to 350', 'cook breakfast sausage in skillet over medium-high heat until browned', 'while sausage is cooking , grease a 8-by-10-inch baking dish and evenly distribute the bread cubes along the bottom', 'remove sausage from skillet with spatula and evenly layer sausage over bread in the baking dish', 'do not drain the fat from the skillet', 'add sliced potatoes to the remaining fat in the skillet and turn occasionally until lightly browned', 'add browned potatoes to the baking dish , evenly layering over sausage', 'evenly pour / smear cheese wiz over top of potatoes', 'whisk together eggs , milk and ground mustard , adding salt and pepper to taste', 'pour over top of casserole dish', 'bake at 350 for 50 minutes , until center is set and puffy', 'allow to cool slightly before attempting to cut', 'serve drizzled with maple syrup']","the name says it all... everything you love about breakfast in one glorious dish. great for breakfast, brunch and the occasional hangover.","['breakfast sausage', 'red potatoes', 'white bread', 'cheese whiz', 'eggs', 'milk', 'ground mustard', 'salt', 'pepper', 'maple syrup']",10
honey sweet cornbread,75,"['time-to-make', 'course', 'preparation', 'breads', 'side-dishes', 'quick-breads', '4-hours-or-less']","[284.2, 15.0, 97.0, 18.0, 9.0, 12.0, 15.0]",10,"['preheat oven to 350 degrees', 'grease and flour 8x8 baking pan and set aside', 'combine flour , cornmeal , baking powder and salt in mixing bowl and set aside', 'place margarine and sugar in large bowl of mixer and cream until smooth', 'add honey and eggs and beat to blend , scraping bottom and sides of bowl frequently', 'beat in half of the milk', 'beat in half of the flour mixture', 'repeat with remaining milk and flour mixture', 'with mixer at lowest speed , continue to mix for 4 minutes', 'pour batter into prepared pan and bake in oven 50 to 60 minutes or until toothpick inserted in center comes out clean']",a simple yet wonderful sweet cornbread that you just have to try!,"['flour', 'cornmeal', 'baking powder', 'salt', 'margarine', 'sugar', 'honey', 'eggs', 'milk']",9
mexican hot cocoa mix,10,"['15-minutes-or-less', 'time-to-make', 'course', 'main-ingredient', 'cuisine', 'preparation', 'north-american', 'beverages', 'mexican', 'chocolate', 'dietary', 'number-of-servings']","[614.0, 18.0, 430.0, 17.0, 20.0, 35.0, 41.0]",12,"['directions for mix:', 'mix all ingredients together well', 'store in airtight container', 'yield approximately 2 cups', 'directions for beverage:', 'in saucepan on medium heat , combine 2 cups of milk or milk substitute', 'add approximately 2 tablespoons of prepared cocoa mix , more or less to taste', 'stir with whisk until warmed', 'do not allow to burn', 'stir almond extract into the warmed milk mixture just before serving', 'add cinnamon stick for garnish if desired', 'yield: 2 servings']",several years ago we received a container of gourmet cocoa mix for christmas. i was never able to find this particular brand again in the store or online so out of frustration i made up my own recipe. i buy the cane sugar in bulk at the natural foods' store. this mix is also very delicious as a substitute in recipes that call for plain cocoa mix and especially delightful in mexican coffee. an ideal recipe for holiday giftgiving.,"['unbleached cane sugar', 'vanilla powder', 'ground cinnamon', 'clove', 'salt', 'cardamom powder', 'anise seed', 'cocoa powder', 'mexican chocolate', 'milk', 'almond extract', 'cinnamon stick']",12
vegan grilled  cheeze  sammiches,10,"['lactose', '15-minutes-or-less', 'time-to-make', 'course', 'main-ingredient', 'cuisine', 'preparation', 'occasion', 'north-american', 'for-1-or-2', 'lunch', 'american', 'easy', 'kid-friendly', 'vegan', 'vegetarian', 'dietary', 'sandwiches', 'comfort-food', 'oamc-freezer-make-ahead', 'inexpensive', 'free-of-something', 'pasta-rice-and-grains', 'taste-mood', 'number-of-servings']","[239.7, 9.0, 16.0, 11.0, 25.0, 5.0, 11.0]",11,"['the cheeze keeps well in the fridge , so if pressed for time you can double or triple it , and microwave for a few seconds to soften before spreading', ""if you don't have a nonstick pan you can lightly butter the bread"", 'combine all remaining ingredients , water to salt , in a small pot over medium-high heat', 'whisk together as it comes to a boil and immediately turn down to low , stirring continuously for a minute or two , till the cheeze is thickened and creamy', 'remove from heat', 'heat a non-stick skillet , or regular if using margarine , on medium', 'spread it on the bread to make sandwiches', 'this makes quite a bit of cheeze for two sandwiches , so you might want to spread it over three', 'grill on preheated skillet till golden , then flip and do other side', 'serve immediately', 'great with a salad or veggie sticks and dip']","this is one of the first vegan recipes i ever tried. while it does not imitate grilled cheese, it has become one of our favorites. gooey and glorious! (from vegan vittles)","['vegan margarine', 'whole wheat bread', 'water', 'nutritional yeast flakes', 'oat flour', 'cornstarch', 'no-added-salt tomato paste', 'tahini', 'lemon juice', 'onion powder', 'garlic granules', 'turmeric', 'dry mustard', 'salt']",14
woodchuck,35,"['60-minutes-or-less', 'time-to-make', 'preparation', 'easy', 'vegetarian', 'dietary']","[806.9, 88.0, 8.0, 29.0, 48.0, 126.0, 16.0]",5,"['make cheese sauce by combining milk , butter , flour and cheese', 'simmer till blended well', 'do not boil', 'saute mushrooms and green pepper in a small amount of butter', 'toss all ingredients together and serve immediatly over warmed chinese noodles']","i have no earthly idea where the name for this came from! this creamy dish, served over chinese noodles is a taste treat!","['milk', 'butter', 'flour', 'cheddar cheese', 'chinese noodles', 'hard-boiled eggs', 'chopped pimiento', 'mushrooms', 'green pepper', 'salt']",10
berry sherbet,10,"['15-minutes-or-less', 'time-to-make', 'course', 'main-ingredient', 'preparation', '5-ingredients-or-less', 'desserts', 'fruit', 'easy', 'frozen-desserts', 'food-processor-blender', 'freezer', 'berries', 'equipment', 'small-appliance', 'number-of-servings', '3-steps-or-less']","[202.1, 0.0, 200.0, 1.0, 3.0, 0.0, 16.0]",2,"['puree all ingredients using a food processor or blender until smooth', 'process according to ice cream maker directions or pour mixture into shallow pan , cover and freeze until firm']",simple sherbet uses frozen fruit for a taste of summer all year round. this is a great recipe for kids to make on a no-school day. recipe source: bon appetit (may 1981),"['unsweetened berries', 'sugar', 'egg white']",3
oven baked buffalo wings,50,"['60-minutes-or-less', 'time-to-make', 'course', 'main-ingredient', 'cuisine', 'preparation', 'north-american', '5-ingredients-or-less', 'very-low-carbs', 'appetizers', 'main-dish', 'poultry', 'american', 'oven', 'easy', 'beginner-cook', 'chicken', 'dietary', 'low-sodium', 'high-protein', 'low-carb', 'inexpensive', 'high-in-something', 'low-in-something', 'meat', 'wings', 'equipment']","[892.6, 107.0, 0.0, 16.0, 125.0, 108.0, 0.0]",20,"['preheat oven to 400f', 'prepare chicken wings by using poultry shears and sniping off the wing', 'this gives you ""2"" wings per wing', 'spread oil on baking sheet', 'spread wings in single layer on baking sheet', 'you may choose to slide wings around on the oiled sheet , to put a light coating of oil on the wings', 'less oil on wings makes for slightly less crispness', 'a bit of oil helps seasoning stick', 'you could omit oil , and spray with a good quality non-stick olive oil product', 'this step is optional', 'sprinkle as liberally as you dare with your choice of seasoning', 'this is where experimentation comes in , be daring , try what\'s in your spice cabinet , however i\'ve come to like a common ""all island soul seasoning"" , with a touch of cayanne or ground red or white pepper', ""if you're cutting back on salt , be cautious of prepared seasoning , as they have a lot of sodium"", 'bake until browned , cooked through , and a bit crispy', 'about 40 minutes', 'use your nose and eyes to check ! i use my convection setting on my oven too , which cuts on the cooking time , but makes a nice crisp even coating', 'remove from oven , and cool for about 15 minutes', 'melt butter and mix with hot sauce', 'toss with the wings in a serving bowl with the butter / hot sauce mixture', 'serve with your favorite blue cheese dressing and celery sticks']","this is an extremely simple oven baked chicken wing ""recipe"". it's roots came out of me being tired of paying premium prices for those frozen cooked buffalo wings in the grocery store! i hesitate to even call it a recipe, since it is so simple.  not fancy, but super simple on time and ingredients.. and still satisfying.","['chicken wings', 'cooking oil', 'soul seasoning', 'hot sauce', 'butter']",5
argentinian steak sandwiches,25,"['30-minutes-or-less', 'time-to-make', 'course', 'cuisine', 'preparation', 'lunch', 'easy', 'south-american', 'argentine', 'sandwiches', '3-steps-or-less']","[573.7, 62.0, 9.0, 13.0, 57.0, 47.0, 8.0]",11,"['to make chimichurri sauce , combine all ingredients from 1 / 2 cup olive oil through 1 / 4 tsp salt in a bowl', 'set aside', 'preheat a barbecue grill or grill pan over mediumhigh heat', 'brush steaks with oil , then season with salt and pepper', 'cook steaks for 3 minutes each side for medium-rare or until cooked to your liking', 'cover loosely with foil and rest for 5 minutes', 'cut a slit lengthwise along top of baguettes , cutting almost to base', 'pull them open without splitting', 'brush inside with mayonnaise , then fill with lettuce and avocado', 'thinly slice steaks across the grain , then divide among sandwiches', 'spoon sauce over the top of the sandwiches and serve']",a simple and quick hearty sandwich with loads of flavor.,"['beef sirloin steaks', 'olive oil', 'salt and pepper', 'french baguettes', 'mayonnaise', 'butter lettuce', 'avocado', 'red wine vinegar', 'shallot', 'tomatoes', 'garlic cloves', 'flat leaf parsley', 'dried oregano', 'hot red pepper', 'salt']",15
raspberry dream delight,15,"['weeknight', '15-minutes-or-less', 'time-to-make', 'course', 'main-ingredient', 'preparation', 'occasion', 'low-protein', 'healthy', 'desserts', 'fruit', 'dinner-party', 'dietary', 'low-sodium', 'low-in-something', 'berries', 'raspberries', 'brunch']","[496.0, 24.0, 311.0, 3.0, 12.0, 48.0, 29.0]",6,"['in a blender combine fruit , condensed milk , cream , lemon juice , sugar and honey', 'blend at high speed until smooth', 'transfer to a plastic container with an airtight seal , cover and freeze 4 hours or until solid', 'let stand a few minutes at room temperature before serving', 'garnish with whole fruit pieces and a sprig of mint', 'alternatively : pour mixture into ice tray mould and freeze 4 hours to create a delicious treat for your kids , or place the frozen cubes into a fresh fruit salad just before serving']","a beautiful fresh frozen dessert, perfect on its own or used as a garnish on another dessert.  very simple and effective, and tastes wonderful!!  it is a lovely light dessert, perfect for after a rich or spicy meal.  i found this recipe on a pack of mccain's frozen raspberries, and it is a firm family favourite.","['frozen raspberries', 'sweetened condensed milk', 'heavy cream', 'lemon juice concentrate', 'white sugar', 'honey']",6
chipotle glazed shrimp,25,"['30-minutes-or-less', 'time-to-make', 'course', 'main-ingredient', 'preparation', 'occasion', 'main-dish', 'seafood', 'romantic', 'shrimp', 'stove-top', 'dietary', 'spicy', 'shellfish', 'taste-mood', 'equipment', 'presentation', 'served-hot']","[222.9, 10.0, 47.0, 14.0, 47.0, 5.0, 5.0]",9,"['in saucepan large enough to hold shrimp , heat olive oil over medium heat , and saute onion until softened , about 5 minutes', 'add garlic , cumin , oregano and saute for 1 minute', 'stir in water , vinegar , chiles , ketchup , orange juice and brown sugar', 'bring to a boil , then lower heat and simmer for about 5 to 10 minutes , until slightly reduced and thickened', 'cover sauce over very low simmer', 'heat oil in large skillet', 'lay shrimp in skillet , sprinkle with old bay if using , and saute shrimp until just done , only about 3 or 4 minutes', 'add shrimp to sauce , and raise heat to high , cooking for about 1 minute , stirring gently until shrimp is coated with glaze', 'serve over hot cooked rice']","spicy! if you love spicy shrimp dishes, this one is for you. i serve it over rice, but you could have it any way you like. for those who don't like it really spicy, reduce the amount of chipotles. would be great barbequed and basted with the sauce. adapted from a magazine clipping. easily cuts in half for smaller servings.","['olive oil', 'onion', 'garlic', 'ground cumin', 'dried oregano', 'water', 'apple cider vinegar', 'chipotle chiles in adobo', 'ketchup', 'orange juice', 'brown sugar', 'medium shrimp', 'oil', 'old bay seasoning']",14
